title,content,category
USA Citizenship  Become a citizen of the USA today possible for everyone Payment with bitcoin,USA Citizenship  Become a citizen of the USA today possible for everyone Payment with bitcoin    LoginRegisterFAQsProductsBecome a citizen of the USA real USA passportWe offer bulletproof USA passports  SSN  Drivers License and Birth Certificate and other papers making you an official citizen of the USAIt will even work if you are not in the USA yetHow we do it Trade secret But we can assure you that you wont have any problems with our papersWe are shipping documents from the USA international shipping is no problemYou can use your own name or a new nameInformation on how to send us required info scanned signature biometric picture etc will be given after purchaseThe total price is 4000 USD 1000 USD paid when you order and the other 3000 when we show you photo and video proof of your passportThe first 1000 USD are needed upfront to see you are serious about it Once paid we will discuss details in our shop internal message systemProductPriceQuantityYour USA citizenship first payment 25 100040001500 USD  005788  X US bank account with online banking and card Great for cashing out bitcoin Accounts will last at least 8 years1000 USD  003859  X ,C. Personal
WeBuyBitcoins  Sell your Bitcoins for Cash USD ACH WUMG LR PayPal and more,WeBuyBitcoins  Sell your Bitcoins for Cash USD ACH WUMG LR PayPal and moreLoginRegisterFAQsSell BitcoinsWeBuyBitcoins  Sell your Bitcoins anonymouslyWe are buying Bitcoins at MtGox market rate just add the desired dollar amount into your shopping cart and give us your payment info on bitcoin checkoutNEW We are now also selling anonymous bitcoin debit cards instantly reloadable and great for cashing out large amounts of bitcoins or just shopping with bitcoins FREE shippingProductPriceQuantityAnonymous no information needed physical bitcoin debit card instantly reloadable100 USD  000386  X Sell BTC worth 50 USD  PayPal50 USD  000193  X Sell BTC worth 100 USD  PayPal100 USD  000386  X Sell BTC worth 500 USD  PayPal500 USD  001929  X Sell BTC worth 50 USD  ACH50 USD  000193  X Sell BTC worth 100 USD  ACH100 USD  000386  X Sell BTC worth 500 USD  ACH500 USD  001929  X Sell BTC worth 50 USD  WUMG50 USD  000193  X Sell BTC worth 100 USD  WUMG100 USD  000386  X Sell BTC worth 500 USD  WUMG500 USD  001929  X Sell BTC worth 50 USD  Cash In Mail50 USD  000193  X Sell BTC worth 100 USD  Cash In Mail100 USD  000386  X Sell BTC worth 500 USD  Cash In Mail500 USD  001929  X Sell BTC worth 50 USD  for Ethereum virtual currency50 USD  000193  X Sell BTC worth 100 USD  for Ethereum virtual currency100 USD  000386  X Sell BTC worth 500 USD  for Ethereum virtual currency500 USD  001929  X Sell BTC worth 100 USD  for Monero virtual currency100 USD  000386  X Sell BTC worth 500 USD  for Monero virtual currency500 USD  001929  X Sell BTC worth 50 USD  for Monero virtual currency50 USD  000193  X ,Bitcoin related services
Onion Identity Services  Get your fake passport and a new identity today,Onion Identity Services  Get your fake passport and a new identity todayProductsInfoRegistrationLoginOrder ProcessAfter buying an ID or passport send us a message with your age and gender so we can find a matching dataset alternatively you can provide a dataset name age gender size etcWe will also need a biometric photo in high quality and signature scanned we will give more instructions after your purchasePassportsProductPriceQuantityLithuanian Passport1350 EUR  005566  X Netherlands Passport1500 EUR  006184  X Denmark Passport1500 EUR  006184  X Great Britain Passport1800 EUR  007421  X Canada Passport1250 EUR  005153  X ID CardsProductPriceQuantityCzech ID Card500 EUR  002061  X Netherlands ID Card550 EUR  002267  X Denmark ID Card550 EUR  002267  X French ID Card550 EUR  002267  X Lithuanian ID Card500 EUR  002061  X Drivers LicensesProductPriceQuantityNorway Drivers License550 EUR  002267  X Denmark Drivers License550 EUR  002267  X Netherlands Drivers License550 EUR  002267  X UK Drivers License500 EUR  002061  X Onion Identity Services,C. Personal
Home  Shadow Wiki,Home  Shadow WikiShadow WikibrowsersdarknetemailhostingimmobilecommssoftwareuspolxmppnamacindexHelloWelcome to the Shadow WikiThis wiki focuses on where applicableNanonymity Privacy  Security  Anonymity Spyware Surveillance Censorship Interoperability and DecentralizationHardwareSoftwarePoliticsReligionNot just what is mainstream but also that which is obscure or esotericWhere things are made how renewable they are and their qualityThis is the orange pillMental Health DisclaimerShadow Wiki touches upon sensitive topics that may not be appropiate for some            people who have certain traits If you are paranoic andor have suicidal            tendencies your conclusions when reading Shadow Wikis contents may cause you            more harmIf you choose to read Shadow Wiki try not to withdraw from society Go outside            touch grass drink water do stretches etcContact and Contribute            We the editors are active in the spyware and digdeeper MUCs            You can send email to shadow at kallist PGP Key                        Theres a forum thread comment section TorOnion I2PEepsite            Git Stagit TorOnion Stagit I2PEepsite            You can use gitsendemail to send in patches            DonateIf you like the content on this wiki and would like to incentivise further content creation on and the maintenance of this wiki consider donatingMoneroXMR Address QR Code 47L6LG9qiU89YKBe9b8tpnQqSaausXSCyjPiNfb4nRsjbEZVU619ThGJBPheGugEMpdcg5yCm1eBj3SU85jiPaE9Ha5JEDrThe Bank Mr Van Buren is trying to kill me but I shall kill it  President Andrew JacksonThere is no free lunch that is why I wait for dinner  aczMirrorsClearnethttpsm13f0netshadowwiki Torhttpabrx6wcpzkfpwxb5eb2wsra2wnkrv2macdtkpnrepswodz5jxd4schydonionI2Phttp63gxkfc4hlcbxrdoepw2i2hyxai5qkxmi636ag3y7sf5tq3imoyab32i2pFAQQ What software are you usingA NAMAC  It statically generates this site from a series of files  A basic tutorial can be found hereQ Where is the religion tableA Coming soonQ Can I own inviteA NoQ Do you have an active link icon for webring useA YesQ Is there a forumsA Yes  TorOnion I2PEepsiteQ Who are youA MeQ When you say I who is being referred toA The person who wrote it which may be a contributor and not mePowered by NAMACLicensed CC0Disclaimer,Personal
Imperial Library of Trantor,Imperial Library of TrantorLog InOr create an account    CancelImperial LibraryHomeAboutNewsUploadForumHelpLoginSignUpThere are 1541045 books on the libraryLast books addedmoreThe Killing Beach  eARCHn lid Krlovstv eskho 23  Dra nhrdelnkAndl smrtiMail Order WifeThe White HareQueen of Darkness Blood  Fangs Book 3romance fantasy mystery contemporary science fiction young adult thriller history fiction adult suspense classics adventure roman biography horror childrens general novela humour philosophy politics science vampires reference religion psychology war self help heft business romanscience fiction travel poetry romanfantasy anthologies romankrimi historical writing erotik spirituality sachbuch health music art paranormal short stories ebook test intriga Chief Librarian Las Zenow zenowriseupnet   Fork the source code from gitlab,Library & Books
TomAndJerry  Extremely stealth shipping from the netherlands ,TomAndJerry  Extremely stealth shipping from the netherlands LoginRegisterProductsTom and Jerry StoreWe have been active during the Agora Evolution Silkroad 3 era then continued through Alphabay and Nucleus and even the late Dream Market and also Wallstreet with the same successful concept High quality drugs combined with an extremely discreet and fast shippingExtremely stealth shipping from the netherlandsHigh Quality Cocaine 90We offer High Quality Cocaine 90 with FREE SHIPPING  All orders that come in before 1400 Dutch local time are shipped the very same day  Shipping internationallyProductPriceQuantity2g High Quality Cocaine90 EUR  000371  X 5g High Quality Cocaine200 EUR  000825  X 10g High Quality Cocaine350 EUR  001443  X 25g High Quality Cocaine750 EUR  003092  X 50g High Quality Cocaine1400 EUR  005772  X 5g High Quality Crack Cocaine220 EUR  000907  X 10g High Quality Crack Cocaine420 EUR  001731  X Pure Afghan Heroin 3 100 Uncut dark real pure Heroin also good for IV use with citric acid  All orders that come in before 1400 Dutch local time are shipped the very same day  FREE shipping internationallyProductPriceQuantity5g Pure Afghan Heroin 3100 EUR  000412  X 10g Pure Afghan Heroin 3190 EUR  000783  X 50g Pure Afghan Heroin 3750 EUR  003092  X High Quality MDMA 84We offer High Quality MDMA 84 with FREE SHIPPING   All orders that come in before 1400 Dutch local time are shipped the very same day  FREE shipping internationallyProductPriceQuantity20g High Quality MDMA90 EUR  000371  X 50g High Quality MDMA180 EUR  000742  X 100g High Quality MDMA300 EUR  001237  X 250g High Quality MDMA600 EUR  002474  X 500g High Quality MDMA1000 EUR  004123  X 250ug LSD  Bicycle Go250ug LSD  Bicycle Go All orders that come in before 1400 Dutch local time are shipped the very same day  FREE shipping internationallyProductPriceQuantity50x 250ug LSD  Bicycle Go100 EUR  000412  X 100x 250ug LSD  Bicycle Go180 EUR  000742  X 250x 250ug LSD  Bicycle Go400 EUR  001649  X 500x 250ug LSD  Bicycle Go690 EUR  002845  X ,Drugs
EasyCoin Bitcoin Wallet and free Bitcoin Mixer  Bitcoin Laundry manage your Bitcoins from any location from any device Iphone Android etc  Online Bitcoin Wallet,EasyCoin Bitcoin Wallet and free Bitcoin Mixer  Bitcoin Laundry manage your Bitcoins from any location from any device Iphone Android etc  Online Bitcoin WalletHomeLoginRegisterBuy BitcoinsFAQWelcome to EasyCoin Bitcoin WalletNow with free Bitcoin mixer you will always get new coins back when you withdraw from your EasyCoin walletYou only pay the Bitcoin transaction feeWe also support completely free account to account transfersClick here to sign up nowFeatures of EasyCoinEasyCoin is a newbie friendly easy to use Bitcoin Wallet and Bitcoin Mixer  LaundryWith EasyCoin you do not have to worry about anonymity and security when using Bitcoin we take care of thatOur integrated mixer makes sure none of your deposited Bitcoins get sent when you make a withdrawal but instead its using funds from other users of the wallet which makes it a true Bitcoin Mixer or Bitcoin Laundry without same coin contaminationWe store all bitcoins encrypted and large amounts only in cold storage which protects EasyCoin from hackers or other malicious peopleStoring and laundering  mixing your bitcoins has never been easierWe respect our users privacy and do not store any information if you are worried about someone knowing about you using Bitcoin you can use our Tor hidden service httpwi3dg355dpiy2g5konionYou can use EasyCoin on any device from your iphone or android phone  tablet to a pc or laptop without installing any programs or appsEasyCoin lets you access your bitcoins from any country and location worldwideWhat is BitcoinBitcoin is an anonymous peertopeer cryptocurrency invented by someone who gave himself the pseudonym Satoshi Nakamoto in 2009It now has millions of users and all bitcoins together are worth over a billion US dollarAll you need to use Bitcoins as a payment method on the internet is a Bitcoin Wallet like EasyCoin and some website or person to buy Bitcoins fromBut bitcoin is only truly anonymous and untraceable if you are really careful not disclosing your identityEasycoin is trying to help with that and protects its users privacy by default instead of having the user take care of it like all other bitcoin walletsAn observer wont be able to track you on the bitcoin blockchain when you use EasyCoin bitcoin walletHow to get startedCreate an account on EasyCoin make sure you write down your username and password and optionally your transaction PIN at a secure placeThen go to the Buy Bitcoins page for a small list of websites selling bitcoins there are dozens more just google for Buy BitcoinsIf you want to buy or sell bitcoins in a really anonymous way without using banks etc check out localbitcoinscom for person to person bitcoin exchangePrivacy Policy  Terms of Use  Contact us,Bitcoin related services
Brainmagic  Biggest onion psychedelics store  order LSD for Bitcoins online,Brainmagic  Biggest onion psychedelics store  order LSD for Bitcoins onlineProductsFAQsRegisterLoginBrainmagic PsychedelicsAll products are tested by ourself and reagent or lab testedSuper stealth shipping from the USA 3 times per weekWe always try to offer the best quality for the best priceProductPriceQuantity30 Hits LSD  150ug95 USD  000367  X 50 Hits LSD  150ug130 USD  000502  X 100 Hits LSD  150ug250 USD  000965  X 300 Hits LSD  150ug570 USD  002199  X 1g Mescaline HCL pure120 USD  000463  X 10g Mescaline HCL pure790 USD  003048  X 1g DMT Freebase100 USD  000386  X 10g DMT Freebase750 USD  002894  X ,Drugs
Endchan,EndchanhomeboardsSFW overboardNSFW overboardaccounthelp irc twitter discord telegram Tools         PoalMe ArchiveIs Webm For RetardsFAQlogshomeboardsSFW overboardNSFW overboardaccountEndchanThe imageboard at the end of the universeThe story so far In 2015 Endchan was created This has made a lot of people very angry and been widely regarded as a bad moveThis is an anonymous imageboard that promotes ideas over identity Here anyone can run their own boards The only three global rules areWere actively working to improve the site Any and all feedback is appreciatedYou must be 18 years or older to visit this siteThis site is actively moderated by our team of volunteersSite Announcements Latest Postspolru309623309620                   polru309622309606                   polru309621            182       polru309620309616            agatha230540huge collection of new movies cpnew lola studio 2023lots of e x t r e m e c h i l d r e n porn movies613yo  zoo andpolru309619          dota5114551141    nido4627huge collection of new movies cpnew lola studio 2023lots of e x t r e m e c h i l d r e n porn movies613yo  zoo andpolru309618309617          agatha23053930533No proof      Board shortcut thread summary      Current Top Boardspolru  pol  Russian Editionagatha2  EGirl Purgatorybb  bausneets  AusNEETsnido  Nidodota  Dota 2bbg  Bonbibonkers Generalbaaa2  Autismindia  indiarus  Russianrapport  Rapportgenshin   yuri  Yuriqrbunker  QR Bunkeramyamy   Discover EndchanAll boards           Eye of Sauron           NSFW Overboard           SFW OverboardBy LanguageEnglish             Espaol                          Portugus             Lietuvi             PolskiItaliano             Magyar             Suomi             Bahasa Indonesia                          Trke                                       EsperantoEnglish CategoriesArt           Advice           Anime  Manga           Entertainment           International           Politics           Tech           WomenIf you would like your board included please contact usAccess options        We have multiple frontends and domains to avoid a single point of failure We have a large number of user uploads and our moderation staff cant always keep up and monitor all content that is produced Plus we have had several bad actors try to shut us down due to the nature of free speech generally acceptable speech doesnt need to be protected        Our Twitter Account or Telegram Channel is the best place for statusFastSecure          EurasiahttpEndchannethttpsEndchannetUShttpEndchangghttpsEndchanggUShttpEndchanorghttpsEndchanorgTor Primaryendchancxfbnrfgauuxlztwlckytq7rgeo5v6pc2zd4nyqo3khfam4adonionTor Backupenxx3byspwsdo446jujc52ucy2pf5urdbhqw3kbsfhlfjwmbpj5smdadonionLokinet supportkqrtg5wz4qbyjprujkz33gza7r73iw3ainqp1mz5zmu16symcdwylokiOpenNIC support detected you can also use endchan Accelerated by CloudFlarelogsdaily graphsarchivesboard claim processglobal rulesFAQDonationsContactEnable NSFW content All posts on Endchan are the responsibility of the individual poster and not the administration of Endchan pursuant to 47 USC  230We have not been served any secret court orders and are not under any gag ordersTo make a DMCA request or report illegal content please contact us    Endchan is powered by MEME GOD DB and InfinityNow a fork of Stephen Lynxs LynxChan engine      Born 122015    IRC InfinityNow  rizonnetGroupTrello8TailedLynxTrelloLynxChan 175InfinityNow 21,Forum
Comic Book Library,Comic Book LibraryHomeTitlesPublishersYearsCreatorsTagsScannersRecentRandomLinksComic Book LibraryTotal Comics 3348Library Updated 20230805Emailcaptaingoatairmailcc,Library & Books
MayVaneDay Studios,MayVaneDay StudiosWelcome to MayVaneDay StudiosTHE ORACLE SPEAKSFIREBRAND WATERSHED EARTHBOUND AIRBORNE ZIRCONS BEACONMy booksPoetryThe World Is Not EnoughThree Years In AbsentiaMoris Mirror and The Adoration CorporationHydraMoris Mirror and The Poetry FactoryFictionIn SeparationThe Viridian Shipping CompanyThe Duality Of MankindLiving WastelandMe Before YouThe White Line FeverThe Samhain FilesAnnouncement Box20230830 So Vultr decided to destroy my server without warning Most services I was able to pull back online on a different VPS provider without too much hassle but I did unfortunately lose a few private keys to hidden services due to a corrupted backup Thanks Vultr you pieces of shit Maybe email me next time you want to open support tickets about muh high CPU usage Some of us like to compile programs from source Anyways Lets Decentralize has a different onion link now Links across all three sites should be updated within the next day20230710 meirl Moving into a new place Expect downtime Will update soon20230425 Ive been employed for about a month Gotten perfect scores on all my performance reviews so far Life is okay for now20230413 Codeberg mirror is down until Forgejo implements user blockingBlogPoetryThe big list of women who did thingsIdentity  ContactMy GPG keyLets DecentralizeDead End Shrine OnlineIPFSI2PYggdrasilFreenetTorGitGemini over TorSpartan over Tor,Personal
Another Hidden Wiki,Another Hidden WikiYet Another Hidden WikiThe Best WORKING Dark Web LinksSet 2jwcnprqbugvyi6ok2h2h7u26qc6j5wxm7feh3znlh2qu3h6hjld4kydonion as your start page in tor browser for quick access to the dark webHidden Wikishttps4k4ceiapwwgcm3mkb6e4diqecpo7kvdnfr5gg7sph7jjppqkvwwqtydonion OnionLinks v3 http6nhmgdpnyoljh5uzr5kwlatx2u3diou4ldeommfxjz3wkhalzgjqxzqdonion The Hidden Wiki  http2jwcnprqbugvyi6ok2h2h7u26qc6j5wxm7feh3znlh2qu3h6hjld4kydonion Another Hidden Wiki  httpjgwe5cjqdbyvudjqskaajbfibfewew4pndx52dye7ug3mt3jimmktkidonion Pugs Ultimate Dark Web Guide  Bitcoin Anonymityhttpy22arit74fqnnc2pbieq3wqqvkfub6gnlegx3cl6thclos4f7ya7rvadonion Dark Mixer  Anonymous bitcoin mixer  httphqfld5smkr4b4xrjcco7zotvoqhuuoehjdvoin755iytmpk4sm7cbwadonion Mixabit  Bitcoin mixer  httpmp3fpv6xbrwka4skqliiifoizghfbjy5uyu77wwnfruwub5s4hly2oidonion EasyCoin  Bitcoin Wallet and Mixer  httpp2qzxkca42e3wccvqgby7jrcbzlf6g7pnkvybnau4szl5ykdydzmvbidonion Onionwallet  Anonymous and secure bitcoin wallet and mixer  httpovai7wvp4yj6jl3wbzihypbq657vpape7lggrlah4pl34utwjrpetwidonion VirginBitcoins  Buy freshly mined clean bitcoins  Drug Storeshttpwbz2lrxhw4dd7h5t2wnoczmcz5snjpym4pr7dzjmah4vi6yywn37bdydonion DCdutchconnectionUK  The dutch connection for the UK  httpiwggpyxn6qv3b2twpwtyhi2sfvgnby2albbcotcysd5f7obrlwbdbkydonion DrChronic  Weed straight from the source  httprfyb5tlhiqtiavwhikdlvb3fumxgqwtg2naanxtiqibidqlox5vispqdonion TomAndJerry  Cocaine Heroin MDMA and LSD from NL  httpajlu6mrc7lwulwakojrgvvtarotvkvxqosb4psxljgobjhureve4kdqdonion 420prime  Cannabis in dispensary quality from the UK  httpguzjgkpodzshso2nohspxijzk5jgoaxzqioa7vzy6qdmwpz3hq4mwfidonion Bitpharma  Biggest european onion drug store  httpn6qisfgjauj365pxccpr5vizmtb5iavqaug7m7e4ewkxuygk5iim6yydonion EuCanna  First Class Cannabis  httpkl4gp72mdxp3uelicjjslqnpomqfr5cbdd3wzo5klo3rjlqjtzhaymqdonion Smokeables  Finest organic cannabis from the USA  http7mejofwihleuugda5kfnr7tupvfbaqntjqnfxc4hwmozlcmj2cey3hqdonion CannabisUK  UK wholesale cannabis supplier  http2ln3x7ru6psileh7il7jot2ufhol4o7nd54z663xonnnmmku4dgkx3adonion Brainmagic  Best Darkweb psychedelics  httpusmost4cbpesx552s2s4ti3c4nk2xgiu763vhcs3b4uc4ppp3zwnscydonion NLGrowers  Coffee Shop grade Cannabis from the Netherlands  httpxf2gry25d3tyxkiu2xlvczd3q7jl6yyhtpodevjugnxia2u665asozadonion Peoples Drug Store  The Darkwebs best Drug supplier  httpsga5n7zx6qjty7uwvkxpwstyoh73shst6mx3okouv53uks7ks47msaydonion DeDope  German Weed Store  More Commercial Linkshttpprjd5pmbug2cnfs67s3y65ods27vamswdaw2lnwf45ys3pjl55h2gwqdonion Dark Web Hackers for hire  http55niksbd22qqaedkw36qw4cpofmbxdtbwonxam7ov2ga62zqbhgty3ydonion AccMarket  Premium Paypal Ebay and bank accounts  https57divisqlcjtsyutxjz2ww77vlbwpxgodtijcsrgsuts4js5hnxkhqdonion Cardshop  USA CVV KNOWN BALANCE  Worldwide CC  CVV  httpjbtb75gqlr57qurikzy2bxxjftzkmanynesmoxbzzcp7qf5t46u7ekqdonion Darkmining  Bitcoin mining with stolen electricity  httpjhi4v5rjly75ggha26cu2eeyfhwvgbde4w6d75vepwxt2zht5sqfhuqdonion Bitcoin Investment Trust  earn 59 per week  httprxmyl3izgquew65nicavsk6loyyblztng6puq42firpvbe32sefvnbadonion Mobile Store  Best unlocked cell phones vendor  httpvhlehwexxmbnvecbmsk4ormttdvhlhbnyabai4cithvizzaduf3gmaydonion Kamagra 4 Bitcoin  Like Viagra but cheaper  httpymvhtqya23wqpez63gyc3ke4svju3mqsby2awnhd3bk2e65izt7baqadonion OnionIdentityServices  Fake passports and ID cards for bitcoin  httpk6m3fagp4w4wspmdt23fldnwrmknse74gmxosswvaxf3ciasficpenadonion Uk Guns and Ammo Store  httplqcjo7esbfog5t4r4gyy7jurpzf6cavpfmc4vkal4k2g4ie66ao5mrydonion USfakeIDs  US fake ID store  httpqazkxav4zzmt5xwfw6my362jdwhzrcafz7qpd5kugfgx7z7il5lyb6adonion Counterfeit USD  High Quality USD counterfeits  httpgd5x24pjoan2pddc2fs6jlmnqbawq562d2qyk6ym4peu5ihzy6gd4jadonion USAcitizenship  become a citizen of the USA  httpt43fsf65omvf7grt46wlt2eo5jbj3hafyvbdb7jtr2biyre5v24pebadonion EuroGuns  httpokayd5ljzdv4gzrtiqlhtzjbflymfny2bxc2eacej3tamu2nyka7bxadonion Apples4Bitcoin  Iphones Ipads and more for bitcoin  http3bp7szl6ehbrnitmbyxzvcm3ieu7ba2kys64oecf4g2b65mcgbafzgqdonion UKpassports  real UK passports  httpxykxv6fmblogxgmzjm5wt6akdhm4wewiarjzcngev4tupgjlyugmc7qdonion ccPal  PayPals Ebays CCs and more  httpkq4okz5kf4xosbsnvdr45uukjhbm4oameb6k6agjjsydycvflcewl4qdonion RentAHacker  Hire a hacker for Bitcoin  httpwk3mtlvp2ej64nuytqm3mjrm6gpulix623abum6ewp64444oreysz7qdonion Webuybitcoins  Sell your Bitcoins for Cash Paypal WU etc  httpodahix2ysdtqp4lgak4h2rsnd35dmkdx3ndzjbdhk3jiviqkljfjmnqdonion HQER  High Quality Euro bill counterfeits  Everything elsehttpdanielas3rtn54uwmofdo3x2bsdifr47huasnmbgqzfrec5ubupvtpidonion DanielWin httpanswerszuvs3gg2l64e6hmnryudl5zgrmwm3vh65hzszdghblddvfiqdonion Hidden Answers httpskcmykvkkt3umiyx4xouu3sjo6odz3rolqphy2i2bbdan33g3zrjfjgqdonion aboutMastodon httpdhosting4xxoydyaivckq7tsmtgi4wfs3flpeyitekkmqwu4v4r46sydonion Daniels Hostinghttpcathug2kyi4ilneggumrenayhuhsvrgn6qv2y47bgeet42iivkpynqadonion cathuggers site httpzgeajoabenj2nac6k5cei5qy62iu5yun5gm2vjnxy65r3p3amzykwxqdonion Darkweb Blog httpozmh2zkwx5cjuzopui64csb5ertcooi5vya6c2gm4e3vcvf2c2qvjiydonion riseup searx http45tbhx5prlejzjgn36nqaxqb6qnm73pbohuvqkpxz2zowh57bxqawkidonion Parckwarts Website httpsidignlwz2odjhgcfhbueinmr23v5bubq2x43dskcebh5sbd2qrxtkidonion securejabber httpsik5nlgfc5qylnnsr57qrbm64zbdx6t4lreyhpon3ychmxmiem7tioadonion Qubes OS httpdds6qkxpwdeubwucdiaord2xgbbeyds25rbsgr73tbfpqpt4a6vjwsydonion Whonix httplldan5gahapx5k7iafb3s4ikijc4ni7gx5iywdflkba5y2ezyg6sjgydonion OnionShare httpnanochanqzaytwlydykbg5nxkgyjxk3zsrctxuoxdmbx5jbh2ydypridonion NanoChanhttppicochanwvqfa2xsrfzlul4x4aqtog2eljll5qnj5iagpbhx2vmfqnidonion PicoChanhttpenxx3byspwsdo446jujc52ucy2pf5urdbhqw3kbsfhlfjwmbpj5smdadonion EndChanhttpdngtk6iydmpokbyyk3irqznceft3hze6q6rasrqlz46v7pq4klxnl4ydonion 256Chanhttpcct5wy6mzgmft24xzw6zeaf55aaqmo6324gjlsghdhbiw5gdaaf4pkadonion Snopytahttpwnrgozz3bmm33em4aln3lrbewf3ikxj7fwglqgla2tpdji4znjp7viqdonion VYempirexyzhttp7sk2kov2xwx6cbc32phynrifegg6pklmzs7luwcggtzrnlsolxxuyfydonion SystemLIorg httpstormwayszuh4juycoy4kwoww5gvcu2c4tdtpkup667pdwe4qenzwaydonion CryptoStorm VPN httpxdkriz6cn2avvcr2vks5lvvtmfojz2ohjzj4fhyuka55mvljeso2ztqdonion Cockli httpeludemailxhnqzfmxehy3bk5guyhlxbunfyhkcksv4gvx6d3wcf6smadonion Eludeinhttplainwir3s4y5r7mqm3kurzpljyf77vty2hrrfkps6wm4nnnqzest4lqdonion qord11net httpcgjzkysxa4ru5rhrtr6rafckhexbisbtxwg2fg743cjumioysmirhdadonion Course Enigma httpkillnod2s77o3axkktdu52aqmmy4acisz2gicbhjm4xbvxa2zfftteydonion Kill9 httpdigdeep4orxw6psc33yxa2dgmuycj74zi6334xhxjlgppw6odvkzkiadonion DigDeeperhttpspywaredrcdg5krvjnukp3vbdwiqcv3zwbrcg6qh27kiwecm4qyfphidonion Spyware Watchdoghttpmeynethaffeecapsvfphrcnfrx44w2nskgls2juwitibvqctk2plvhqdonion May Vane Day Studioshttpzsxjtsgzborzdllyp64c6pwnjz5eic76bsksbxzqefzogwcydnkjy3ydonion Shadow Wikihttpg7ejphhubv5idbbu3hb3wawrs5adw7tkx7yjabnf65xtzztgg4hcsqqdonion Defconhttpp53lf57qovyuvwsc6xnrppyply3vtqm7l6pcobkmyqsiofyeznfu5uqdonion Propublicahttpdarkzzx4avcsuofgfez5zq75cqc4mprjvfqywo45dfcaxrwqg6qrlfidonion Darknetlivehttpkeybase5wmilwokqirssclfnsqrjdsi7jdir5wy7y7iu3tanwmtp6oidonion KeyBaseIOhttpciadotgov4sjwlzihbbgxnqg3xiyrg7so2r2o3lt5wz5ypk4sxyjstadonion CIAGOVhttparchivebyd3rzt3ehjpm4c3bjkyxv3hjleiytnvxcn7x32psn2kxcuidonion Internet Archivehttpbible4u2lvhacg4b3to2e2veqpwmrc2c3tjf2wuuqiz332vlwmr4xbadonion Bible4uhttpkx5thpx2olielkihfyo4jgjqfb7zx7wxr3sd4xzt26ochei4m6f7taydonion Imperial Libraryhttpnv3x2jozywh63fkohn5mwp2d73vasusjixn3im3ueof52fmbjsigw6adonion Comic Books,Directory/Wiki
