title,content,category
cryptostorm, cryptostormToggle navigationcryptostormwhoprivacysecuritybenefitslocationsbuyconnectcontactfaqblogsitemapcryptostormThe VPN service provider for the truly paranoidThis website is also available as a Tor hidden service atstormwayszuh4juycoy4kwoww5gvcu2c4tdtpkup667pdwe4qenzwaydonionand the I2P eepsite at csi2pPrivacyKeep your online activities privateSecurityProtect your internet traffic at public WiFi hotspots or from ISPgovernment surveillanceBenefitsMore unique features than any other VPN providerPRIVACYArguing that you dont care about the right to privacy because you have nothing to hide is no different than saying you dont care about free speech because you have nothing to say  Edward SnowdenBare metal serversdedicated servers onlyNo logsOur VPN servers never save data that can be used to identify a customerChaining supportedDont trust that were not loggingUse multihop to connect to another VPN or Tor before you connect to usOpen sourceno proprietary codeAll serverside configs are publicAvailable for review hereSecurity through transparencytoo many details on how the network operates available on our blog and on ourprivacy policy pageTokenbased network accessanonymous authenticationHashed tokensAccess tokens are hashed before connecting Compromisedconfiscated servers cant be used to identify clientsDecentralized organizationroots in Iceland entities worldwideFinancials in several regionsNo central office anywhereSECURITYSomeone wearing a tinfoil hat might say were too paranoidOpenVPN ECCEd25519 Ed448 and secp521r1 instances521bit EC 15360bit RSATLSv13 supportedAEAD authentication256bit AES or ChaCha20Poly1305Resistant to quantum attacksOpenVPN RSAOur least secure option is stronger than most VPN providers strongest option8192bit RSA server certificate521bit EC 15360bit RSA CA8192bit DH params256bit AES or ChaCha20Poly1305Safe from padding oracle attacksWireGuardChaCha20 for symmetric encryption authenticated with Poly1305 using RFC7539s AEAD constructionCurve25519 for ECDHBLAKE2s for hashing and keyed hashing described in RFC7693SipHash24 for hashtable keysHKDF for key derivation as described in RFC5869Customized systemsgrsecurity linuxhardened kernelsexploit mitigationhardened against heap corruptionPrinciple of least privilege practicedMandatory access controlPrivilege seperationIntegrity verifiedtripwire used to prevent backdoorsDisposable serversSecure PKI managementConfiscating one server wont compromise the restBENEFITSFeatures you wont find anywhere elseDeepDNS systemprotecting clients before they connectencrypted DNS serversChain DNS traffic with Anonymized DNSDNSCrypt v2Public DNSCrypt servers for encrypting your DNS traffic before you connectTransparent onioni2p accessDirect access to darknetsAntileak protectionkeeping your real IP safeDNSWebRTC leak protectionStops IP leaksDNSbased adtracker blockingPrevents malicious trackers from workingKill switch includedMany different killswitches available to prevents leaks if disconnectedFlexible connection optionsbypass restrictive firewallsSSHHTTPS tunnelingMake your traffic look like SSH or HTTPSConnect on any portUDP or TCP 129999BitTorrent allowedPort forwarding supportedSafe from the Port Fail vulnerabilityUnlimited bandwidthunrestricted accessNo data caps no throttlingnot even on our free serviceRedundant load balancingMinimizes downtimeServer locationscryptostormisuptime for the detailed listBUY NOWCant afford to buy now Try out our free service CryptofreeThe devices number below would be the maximum number of devices allowed to connect at the same time If you need to connect more devices buy more tokens or buy ones that allow more devices or setup your router to use cryptostormcredit cardPayPalfriendly pricing quick accessrecurring subscriptions USDyearly   52 4 devicesmonthly  6 1 deviceweekly  186 1 devicePAYPAL SUBSCRIBEPAYPAL UNSUBSCRIBEsingle order USD nonrecurringone week  186 1 deviceone month  6 1 devicethree months  16 2 devicessix months  28 3 devicesone year  52 4 devicestwo years  94 5 devices5x 1month bundle  2411x 1month bundle  4825x 1month bundle  97lifetime  500 6 devicesPAYPAL ORDERcredit cardCCBillsupports most prepaid cardsYou must enable JavaScript in your web browser to pay via CCBillsingle order USD nonrecurringone month  6 1 devicethree months  16 2 devicessix months  28 3 devicesone year  52 4 devicesCCBILL ORDERBitcoinBitPaypay with Bitcoinone month  6 1 devicethree months  16 2 devicessix months  28 3 devicesone year  52 4 devicestwo years  94 5 devices5x 1month bundle  2411x 1month bundle  4825x 1month bundle  97lifetime  500 6 devicesBITCOIN ORDERBitpay orderEmail address  SUBMIT  Enter your email address to receive your token via email I dont want my token emailed to meYou must enable JavaScript in your web browser to pay with BitcoinaltcoinsCoinPaymentssupport for other popular coinsOur XMR address4B9mhTbeHwD4NAc5Mr68ejfxzNsxppVv7MD5aiiwJiXJaLryYqrxq1C5ANJUR7z7WCihb7UndrHWCQbgpoqFkit5LVn16tVsend TX ID and duration to supportcryptostormis and we will send the token ASAP only tokens  1 monthCoinPayments orderOn the next page the first and last name can be left as NA but the email address has to be realYour cryptostorm access token will be delivered to the email address you provideIf you dont want to use your real email address use a disposable email service such as our httpscsemailno signup required  I understand  You must enable JavaScript in your web browser to pay with altcoinsCONNECT TO CRYPTOSTORMWe use OpenVPN so if they support your OS then so do we We also support WireGuardWindowsBe sure to also check out our blog  token hasher  MaciOSLinuxAndroidRouters SHA512 CalculatorToken  Calculate  Hash Uses jsSHA 13 by Brian Turek jsshasourceforgenetTake the above result from the Hash field and use it as username in your OpenVPN window Password can be left blankThis calculates your tokens hash client side using Javascript in your fave browser soin theoryyour token will never get on the wires and thus will never be seen by othersThis obviously requires Javascript which is sort of the point as it keeps things on your PC as opposed to out on the wires where the NSA or whoever can scrape them off of the interwebs so if youre using Noscript or have Javascript turned off youre pretty much better off using other methods for getting your hash SorrySOCIAL MEDIAEMAILinfocryptostormissupportcryptostormisfermicryptostormisdfcryptostormistranslations         refund policy                                                                                privacy policy                                                                                terms of servicesitemap  live chat  token verify  warrant canary  ,Privacy
CannabisUK  UK Wholesale Cannabis Supplier  order weed online in the UK for bitcoin  marijuana for bitcoin  cannabis for bitcoin,CannabisUK  UK Wholesale Cannabis Supplier  order weed online in the UK for bitcoin  marijuana for bitcoin  cannabis for bitcoin    LoginRegisterFAQsAbout usProductsPurple KushBeautiful AAA PK caked in crystal Nice colour distinctly purple Close trimmed fluffy fat buds Pungent kush aroma and flavour ProductPriceQuantity20g Purple Kush140 GBP  000666  X 50g Purple Kush290 GBP  001380  X 100g Purple Kush550 GBP  002617  X AfghaniAfghani Nice looking cyrstally kush sweet flavour potent indica strainProductPriceQuantity20g Afghani135 GBP  000642  X 50g Afghani280 GBP  001332  X 100g Afghani535 GBP  002546  X CannabisUK,Drugs
OnionLinks,OnionLinksOnionLinksShort onion v2 websites will stop working in October 2021 Bookmark OnionLinks or DARKWEBLINKSCOM for working v3 onion sitesNavigationIntroduction Points Financial Services Commercial Services Drugs Chans Privacy Services Email Providers Blogs And Personal Sites Hacking News Sites Open Source Software Others Introduction PointsOnionLinks s4k4ceiapwwgcm3mkb6e4diqecpo7kvdnfr5gg7sph7jjppqkvwwqtydonion The Hidden Wiki paavlaytlfsqyvkg3yqj7hflfg5jw2jdg2fgkza5ruf6lplwseeqtvydonion Another Hidden Wiki 2jwcnprqbugvyi6ok2h2h7u26qc6j5wxm7feh3znlh2qu3h6hjld4kydonion The Dark Web Pug jgwe5cjqdbyvudjqskaajbfibfewew4pndx52dye7ug3mt3jimmktkidonion The Original Hidden Wiki zqktlwiuavvvqqt4ybvgvi7tyo4hjl5xgfuvpdf6otjiycgwqbym2qadonion Financial ServicesAccMarket 55niksbd22qqaedkw36qw4cpofmbxdtbwonxam7ov2ga62zqbhgty3ydonion Cardshop s57divisqlcjtsyutxjz2ww77vlbwpxgodtijcsrgsuts4js5hnxkhqdonion Dark Mixer y22arit74fqnnc2pbieq3wqqvkfub6gnlegx3cl6thclos4f7ya7rvadonion Mixabit Bitcoin Mixer hqfld5smkr4b4xrjcco7zotvoqhuuoehjdvoin755iytmpk4sm7cbwadonion VirginBitcoins ovai7wvp4yj6jl3wbzihypbq657vpape7lggrlah4pl34utwjrpetwidonion ccPal xykxv6fmblogxgmzjm5wt6akdhm4wewiarjzcngev4tupgjlyugmc7qdonion Webuybitcoins wk3mtlvp2ej64nuytqm3mjrm6gpulix623abum6ewp64444oreysz7qdonion HQER odahix2ysdtqp4lgak4h2rsnd35dmkdx3ndzjbdhk3jiviqkljfjmnqdonion Counterfeit USD qazkxav4zzmt5xwfw6my362jdwhzrcafz7qpd5kugfgx7z7il5lyb6adonion EasyCoin Bitcoin Mixer mp3fpv6xbrwka4skqliiifoizghfbjy5uyu77wwnfruwub5s4hly2oidonion Onionwallet Bitcoin Mixer p2qzxkca42e3wccvqgby7jrcbzlf6g7pnkvybnau4szl5ykdydzmvbidonion Commercial ServicesDarkWebHackers prjd5pmbug2cnfs67s3y65ods27vamswdaw2lnwf45ys3pjl55h2gwqdonion Mobile Store rxmyl3izgquew65nicavsk6loyyblztng6puq42firpvbe32sefvnbadonion Kamagra 4 Bitcoin vhlehwexxmbnvecbmsk4ormttdvhlhbnyabai4cithvizzaduf3gmaydonion OnionIdentityServices ymvhtqya23wqpez63gyc3ke4svju3mqsby2awnhd3bk2e65izt7baqadonion UkGunsAndAmmo k6m3fagp4w4wspmdt23fldnwrmknse74gmxosswvaxf3ciasficpenadonion USfakeIDs lqcjo7esbfog5t4r4gyy7jurpzf6cavpfmc4vkal4k2g4ie66ao5mrydonion EuroGuns t43fsf65omvf7grt46wlt2eo5jbj3hafyvbdb7jtr2biyre5v24pebadonion Apples4Bitcoin okayd5ljzdv4gzrtiqlhtzjbflymfny2bxc2eacej3tamu2nyka7bxadonion UKpassports 3bp7szl6ehbrnitmbyxzvcm3ieu7ba2kys64oecf4g2b65mcgbafzgqdonion USAcitizenship gd5x24pjoan2pddc2fs6jlmnqbawq562d2qyk6ym4peu5ihzy6gd4jadonion RentAHacker kq4okz5kf4xosbsnvdr45uukjhbm4oameb6k6agjjsydycvflcewl4qdonion DrugsDCdutchconnectionUK wbz2lrxhw4dd7h5t2wnoczmcz5snjpym4pr7dzjmah4vi6yywn37bdydonion DrChronic iwggpyxn6qv3b2twpwtyhi2sfvgnby2albbcotcysd5f7obrlwbdbkydonion TomAndJerry rfyb5tlhiqtiavwhikdlvb3fumxgqwtg2naanxtiqibidqlox5vispqdonion 420prime ajlu6mrc7lwulwakojrgvvtarotvkvxqosb4psxljgobjhureve4kdqdonion Bitpharma guzjgkpodzshso2nohspxijzk5jgoaxzqioa7vzy6qdmwpz3hq4mwfidonion EuCanna n6qisfgjauj365pxccpr5vizmtb5iavqaug7m7e4ewkxuygk5iim6yydonion Smokeables kl4gp72mdxp3uelicjjslqnpomqfr5cbdd3wzo5klo3rjlqjtzhaymqdonion CannabisUK 7mejofwihleuugda5kfnr7tupvfbaqntjqnfxc4hwmozlcmj2cey3hqdonion Brainmagic 2ln3x7ru6psileh7il7jot2ufhol4o7nd54z663xonnnmmku4dgkx3adonion NLGrowers usmost4cbpesx552s2s4ti3c4nk2xgiu763vhcs3b4uc4ppp3zwnscydonion Peoples Drug Store xf2gry25d3tyxkiu2xlvczd3q7jl6yyhtpodevjugnxia2u665asozadonion DeDope sga5n7zx6qjty7uwvkxpwstyoh73shst6mx3okouv53uks7ks47msaydonion Chans 8Chan 4usoivrpy52lmc4mgn2h34cmfiltslesthr56yttv2pxudd3dapqciydonion Nanochan nanochanqzaytwlydykbg5nxkgyjxk3zsrctxuoxdmbx5jbh2ydypridonion Picochan picochanwvqfa2xsrfzlul4x4aqtog2eljll5qnj5iagpbhx2vmfqnidonion Endchan enxx3byspwsdo446jujc52ucy2pf5urdbhqw3kbsfhlfjwmbpj5smdadonion 256Chan dngtk6iydmpokbyyk3irqznceft3hze6q6rasrqlz46v7pq4klxnl4ydonion THE END theendgtso35ir6ngdtyhgtjhhbbprmkzl74gt5nyeu3ocr34sfa67ydonion Privacy Services Snopyta cct5wy6mzgmft24xzw6zeaf55aaqmo6324gjlsghdhbiw5gdaaf4pkadonion Riseup vww6ybal4bd7szmgncyruucpgfkqahzddi37ktceo3ah7ngmcopnpyydonion Vyempirexyz wnrgozz3bmm33em4aln3lrbewf3ikxj7fwglqgla2tpdji4znjp7viqdonion SystemLiorg 7sk2kov2xwx6cbc32phynrifegg6pklmzs7luwcggtzrnlsolxxuyfydonion Cryptostorm VPN stormwayszuh4juycoy4kwoww5gvcu2c4tdtpkup667pdwe4qenzwaydonion Privacy Tools privacy2zbidut4m4jyj3ksdqidzkw3uoip2vhvhbvwxbqux5xy5obydonion TiTan XMPP titanxsu7bfd7vlyyffilprauwngr4acbnz27ulfhyxrqutu7atyptadonion Email Providers Cockli xdkriz6cn2avvcr2vks5lvvtmfojz2ohjzj4fhyuka55mvljeso2ztqdonion Eludein eludemailxhnqzfmxehy3bk5guyhlxbunfyhkcksv4gvx6d3wcf6smadonion Sonar Tor Messenger sonarmsng5vzwqezlvtu2iiwwdn3dxkhotftikhowpfjuzg7p3ca5eidonion ProtonMail protonmailrmez3lotccipshtkleegetolb73fuirgj7r4o4vfu7ozydonion RiseUp Email 5gdvpfoh6kb2iqbizb37lzk2ddzrwa47m6rpdueg2m656fovmbhoptqdonion Blogs And Personal Sites qorg11net lainwir3s4y5r7mqm3kurzpljyf77vty2hrrfkps6wm4nnnqzest4lqdonion Course Enigma cgjzkysxa4ru5rhrtr6rafckhexbisbtxwg2fg743cjumioysmirhdadonion Kill9 killnod2s77o3axkktdu52aqmmy4acisz2gicbhjm4xbvxa2zfftteydonion Digdeeper digdeep4orxw6psc33yxa2dgmuycj74zi6334xhxjlgppw6odvkzkiadonion Spware Watchdog spywaredrcdg5krvjnukp3vbdwiqcv3zwbrcg6qh27kiwecm4qyfphidonion MayVaneDay Studios meynethaffeecapsvfphrcnfrx44w2nskgls2juwitibvqctk2plvhqdonion Shadow Wiki zsxjtsgzborzdllyp64c6pwnjz5eic76bsksbxzqefzogwcydnkjy3ydonion Outer Space reycdxyc24gf7jrnwutzdn3smmweizedy7uojsa7ols6sflwu25ijoydonion Tech Learning Collective lpiyu33yusoalp5kh3f4hak2so2sjjvjw5ykyvu2dulzosgvuffq6sadonion Fuwa Fuwa fwfwqtpi2ofmehzdxe3e2htqfmhwfciwivpnsztv7dvpuamhr72ktlqdonion SConfig xjfbpuj56rdazx4iolylxplbvyft2onuerjeimlcqwaihp3s6r4xebqdonion Hacking Defcon g7ejphhubv5idbbu3hb3wawrs5adw7tkx7yjabnf65xtzztgg4hcsqqdonion InfoCon w27irt6ldaydjoacyovepuzlethuoypazhhbot6tljuywy52emetn7qdonion News Sites ProPublica p53lf57qovyuvwsc6xnrppyply3vtqm7l6pcobkmyqsiofyeznfu5uqdonion Darknetlive darkzzx4avcsuofgfez5zq75cqc4mprjvfqywo45dfcaxrwqg6qrlfidonion Open Source Software OnionShare lldan5gahapx5k7iafb3s4ikijc4ni7gx5iywdflkba5y2ezyg6sjgydonion Whonix dds6qkxpwdeubwucdiaord2xgbbeyds25rbsgr73tbfpqpt4a6vjwsydonion Qubes OS wwwqubesosfasa4zl44o4tws22di6kepyzfeqv3tg4e3ztknltfxqrymdadonion KeybaseIO keybase5wmilwokqirssclfnsqrjdsi7jdir5wy7y7iu3tanwmtp6oidonion Bitcoin Core 6hasakffvppilxgehrswmffqurlcjjjhd76jgvaqmsg6ul25s7t3rzydonion Wasabi Wallet wasabiukrxmkdgve5kynjztuovbg43uxcbcxn6y2okcrsg7gb6jdmbadonion The Tor Project 2gzyxa5ihm7nsggfxnu52rck2vv4rvmdlkiu3zzui5du4xyclen53widonion Others CIAgov ciadotgov4sjwlzihbbgxnqg3xiyrg7so2r2o3lt5wz5ypk4sxyjstadonion Internet Archive archivebyd3rzt3ehjpm4c3bjkyxv3hjleiytnvxcn7x32psn2kxcuidonion Bible4u bible4u2lvhacg4b3to2e2veqpwmrc2c3tjf2wuuqiz332vlwmr4xbadonion Imperial Library kx5thpx2olielkihfyo4jgjqfb7zx7wxr3sd4xzt26ochei4m6f7taydonion Comic Book Library nv3x2jozywh63fkohn5mwp2d73vasusjixn3im3ueof52fmbjsigw6adonion Tor Paste torpastezr7464pevuvdjisbvaf4yqi4n7sgz7lkwgqwxznwy5duj4adonion Fuck Facebook 4wbwa6vcpvcr3vvf4qkhppgy56urmjcj2vagu2iqgp3z656xcmfdbiqdonion Just Another Library libraryfyuybp7oyidyya3ah5xvwgyx6weauoini7zyz555litmmumadonion Google Feud lkqx6qn7whctpdjhcoohpoyi6ahtrveuii7kq2m647ssvo5skqp7ioadonion NCIDE Police Task Force ncidetfs7banpz2d7vpndev5somwoki5vwdpfty2k7javniujekit6adonion Rewards For Justice he5dybnt7sr6cm32xt77pazmtm65flqy6irivtflruqfc5ep7eiodiadonion Ablative Hosting hzwjmjimhr7bdmfv2doll4upibt5ojjmpo3pbp5ctwcg37n3hyk7qzidonion KlosHost kaizushih5iec2mxohpvbt5uaapqdnbluaasa2cmsrrjtwrbx46cnaidonion SporeStack Hosting spore64i5sofqlfz5gq2ju4msgzojjwifls7rok2cti624zyq3fceladonion Blockstream BTC Explorer explorerzydxu5ecjrkwceayqybizmpjjznk5izmitf2modhcusuqlidonion BlockChair BTC Explorer blkchairbknpn73cfjhevhla7rkp4ed5gg2knctvv7it4lioy22defidonion Shitposting Forum bombsjy5lsgehdyuevxu5kt3zdw22bfqrhbanc32evab3o3j3dvc7cidonion The Longest Onion Index jptvwdeyknkv6oiwjtr2kxzehfnmcujl7rf7vytaikmwlvze773uiyydonion OnionLinks,Directory/Wiki
DrChronic  Weed straight from the source,DrChronic  Weed straight from the sourceProductsRegistrationLoginDrChronic  Shipping from USAStraight from the source We dont lose packages your privacy and satisfaction is our top priority Here at DrChronic we strive to meet and exceed customer expectations and always conduct our business professionally with integrityWe currentlz ship MONWEDFRI and all orders received before 12pm PST on those dazs will ship same dayNO REFUND OR RESHIPMENT ON ORDERS THAT SHOW DELIVERED Shipping is 5 FREE for orders over 200ProductPriceQuantitySKUNK KUSH  1oz120 USD  000463  X SKUNK KUSH 3oz300 USD  001158  X SKUNK KUSH 5oz450 USD  001736  X TRAINWRECK 1oz125 USD  000482  X TRAINWRECK 3oz310 USD  001196  X TRAINWRECK 5oz460 USD  001775  X SOUR DIESEL 1oz120 USD  000463  X SOUR DIESEL 3oz300 USD  001158  X SOUR DIESEL 5oz450 USD  001736  X ,Drugs
UK Guns and Ammo Store  Buy guns and ammo in the UK for Bitcoin,UK Guns and Ammo Store  Buy guns and ammo in the UK for BitcoinProductsInfoRegistrationLoginGunsOnly 3 x P99 and 2 x Glock 19 left we will get new stock of similar weapons once those are soldProductPriceQuantityGlock 19  9mm  new and unused500 GBP  002379  X Walther P99  9mm  new and unused650 GBP  003093  X Ammo ProductPriceQuantity100 x 9mm Bullets for Glock 1950 GBP  000238  X 100 x 9mm Bullets for Walther P9950 GBP  000238  X ,Ilegal Marketplace
Dark Mixer anonymous bitcoin mixer,Dark Mixer anonymous bitcoin mixerHomeLoginRegisterHow to get perfectly anonymous bitcoins in 3 easy stepsStep 1Sign up at Dark Mixer and send bitcoins from your old wallet to your new Dark Mixer walletStep 2Wait a random amount of time ideally a few daysStep 3Withdraw your bitcoins as you need them to make paymentsIf you send 300 worth of bitcoins to the Dark Mixer and withdraw in smaller parts of for example 50 100 80 then there will be no possibility at all to even guess which transaction is yours and which belongs to another userWhy most other mixers are NOT safe at all1 If they are on the clearweb then they will be seized sooner or later like for example bestmixerEven if they do not keep logs law enforcement can monitor the server since it is no problem to find and seize clearweb servers2 Most mixers do not use a wallet you send X bitcoins to them and they send X bitcoins minus fee back This is super easy to deanonymize for blockchain analytics companiesConclusion Only use dark web wallets like Dark Mixer as a mixer to keep your bitcoins anonymousThere are currently no fees except the bitcoin network fees for using the mixerWe are earning BTC from other sites and are cleaning our coins on this mixer so we do not need a fee to run this serviceThis might change in the future and we might charge a small fee but we will give notice in advanceNo reason to pay a high fee to mixers which do not even work Stay safeDark Mixer,Bitcoin related services
Peoples Drug Store  The Darkwebs Best Online Drug Supplier  Buy cocaine speed xtc mdma heroin and more at peoples drug store pay with Bitcoin,Peoples Drug Store  The Darkwebs Best Online Drug Supplier  Buy cocaine speed xtc mdma heroin and more at peoples drug store pay with Bitcoin    LoginRegisterFAQsAbout usProductsTHEPEOPLES DRUG STORE prideourselves on offering the best quality products at competitive pricesand making every effort to go above and beyond when it comes tocustomer satisfactionChoose a category by clicking on any of the following HeroinCocaineEcstasy Speed CannabisPrescriptions Bitcoins and ServicesWANNA MAKE SOME FREE BTC  Tell others about this shop and earn 5 from every purchase they will make Simply give them the following linkhttpwwwpeoplesdrugstoreorgrefYOURUSERNAME or the original httpnewpdsuslmzqazvronionrefYOURUSERNAMEReplace YOURUSERNAME with your actual username on this site and get earnings directly to your walletSW Asian 4 Heroin  The Heroin we offer comes direct from theimporter with no middle manIt is whitelight beige incolor and we take great pride in the fact that we do not cutour product whatsoever and we ensure that our source doesnot do so either We would much prefer tooffer a high quality product and have repeat customers Whatsthe difference between 3 and 4 heroinMost people know this butwe do get this asked often enough that we decided to add thisinformation onto the listingThe most commonly foundforms of Heroin are 3 and 4No4 grade Heroinis the PUREST form of Heroin It is a white powder that iseasily dissolved in water and thus readily injected No3grade Heroinis a tancoloured granular product often referred to as brownrockThe difference in colorbetween No4 and No3 grades is a result of impurities introducedduring or remaining after the manufacturing process No3 grade iscommonly heated and the vapors inhaled It can be injected but ithas to be dissolved in citrus instead of waterTokeep it simple think about it like this 4Heroinis water soluable and MUCH more pure and desireableamong IV users and people who sniff whereas 3 is for people whoprefer to smoke itHowever 4 Heroincan be smoked as well usually by adding cafeine or anotheradulterant to make it burn slowerProductPriceQuantityPack of 10x1cc BD Insulin Syringes10 USD  000039  X HALF GRAM HEROIN4 050g60 USD  000232 Sold outGRAND OPENING SPECIAL FULL WEIGHED GRAM HEROIN4 10g100 USD  000386 Sold outSW ASIAN 4 HEROIN 2x FULL WEIGHED GRAMS 180 USD  000695  X GRAND OPENING SPECIAL5 FULL GRAMS HEROIN4390 USD  001505  X Peoples Drug Store  The Darkwebs Best Online Drug Supplier,Drugs
TorShops  Create your own onion store  buy and sell drugs guns counterfeits fake ids fake passports for bitcoin,TorShops  Create your own onion store  buy and sell drugs guns counterfeits fake ids fake passports for bitcoinProductsLoginRegisterInfoBuy your own onion storeGet your own onion store with full Bitcoin integrationYou want to run an independent shop as a Tor hidden service anonymouslyYou want to accept Bitcoins as payment for your goods or servicesMaybe already selling on SilkRoad but you would prefer to have your own websiteTorShops lets you create a shop like this for affordable pricesWith TorShops anyone can run a store as a Tor hidden service and accept Bitcoins without having to worry about technical detailsCreate an account to contact us if you have any questionsFeatures Integrated Bitcoin Wallet Message Center for easy communication with customers Easy tracking of orders users have to pay before order gets submitted Intelligent inventory management Support for multiple categories You may use HTML to make your product descriptions more unique Secure and fast server with daily backups Your own onion domain with 6 characters at the beginning which you can choose example 123456xxxxxxxxxxonion Choose between many free design templates or buy your own custom design template Free custom logo for every store SubForum in the TorShops Forums for user feedback and reviewsClick here for a list of FREE designsPricing Setup fee is currently 100 USD Sales fee is 6 of your sales 35 for large volume sellers on individual basis See upgrades for store upgrade pricesGet started nowProductPriceQuantityYour own onion store100 USD  000386  X Store upgradesPurchase upgrades for your store hereProductPriceQuantityFully custom shop design made by one of our designers500 USD  001929  X Your own forums on an extra onion address150 USD  000579  X TorShops  Create your own onion store  buy and sell drugs guns counterfeits fake ids fake passports for bitcoin,Ilegal Marketplace
Dark Web Hackers,Dark Web Hackers    LoginRegisterProductsWelcome to the Dark Web HackersHave you tried to buy hacking services on the dark web before Not happy with the results Only empty promises but no one getting the job doneThen you should try Vladimir and George the dark webs most trusted hackers for getting things doneUnlike others our prices are not the cheapest but if we cant do a job you will get a full refundVladimirHello my name is VladimirI am the technical expert at dark web hackersMy expertise is programming running exploits setting up DDOS attacks and i like the challenge of doing things where most others give upI can recover passwords of most social networks easily remote control smartphones and most other things that are useful because i spent years to find methods that really workHere you can find a list of my services if it is not listed then minimum price will be 600 and we will discuss the final price once you gave me all information and i accept the jobProductPriceQuantityRemote control the phone of someone else most new models supported700 USD  002701  X Facebook and Twitter account hacking500 USD  001929  X Other social network account hacks for example reddit or instagram450 USD  001736  X Full package deal getting access to personal or company devices and accounts and searching for the data you need1800 USD  006945  X DDOS for protected websites for 1 month900 USD  003473  X DDOS for unprotected websites for 1 month400 USD  001543  X Hacking webservers game servers or other internet infrastructure1300 USD  005016  X 30 days full service i will work 8 hours per day for 30 days only on your project9500 USD  036656  X Other services final price will be discussed600 USD  002315  X Only additionaly Add this item if your target is a high profile VIP or large public company2500 USD  009646  X Only additionally priority service or 1 full day extra work for complicated cases400 USD  001543  X GeorgeHello my name is GeorgeMy hacking skills are not as perfect as Vladimirs but i am really good with social engineeringAnd i really like messing with people i dont care what you want to do to themIf there is something i cant do then Vladimir will help and teach me for next timeProductPriceQuantityDestroying someones life Your target will have legal problems or financial problems proven methods including child porn that always works1700 USD  006559  X Spreading false information about someone on social media not as life ruining but still nasty450 USD  001736  X Social engineering to get secrets from a person private or from some employee450 USD  001736  X Other social engineering work500 USD  001929  X 30 days full service i will work 8 hours per day for 30 days only on your project7500 USD  028939  X Only additionally priority service or 1 full day extra work for complicated cases400 USD  001543  X Only additionaly Add this item if your target is a high profile VIP or large public company2500 USD  009646  X Dark Web Hackers,Hacking
