title,content,category
The Hidden Wiki,      The Hidden Wiki        The Hidden Wiki     The Original Hidden Wiki  Only  6nhmgdpnyoljh5uzr5kwlatx2u3diou4ldeommfxjz3wkhalzgjqxzqdonion         Update 072020 The old short v2 onion hidden service links will no longer work after october 2021 We will list only v3 onions in the future  Dark web link collections https4k4ceiapwwgcm3mkb6e4diqecpo7kvdnfr5gg7sph7jjppqkvwwqtydonion OnionLinks v3  http6nhmgdpnyoljh5uzr5kwlatx2u3diou4ldeommfxjz3wkhalzgjqxzqdonion The Hidden Wiki   http2jwcnprqbugvyi6ok2h2h7u26qc6j5wxm7feh3znlh2qu3h6hjld4kydonion Another Hidden Wiki   httpjgwe5cjqdbyvudjqskaajbfibfewew4pndx52dye7ug3mt3jimmktkidonion Pugs Ultimate Dark Web Guide    Commercial links httpprjd5pmbug2cnfs67s3y65ods27vamswdaw2lnwf45ys3pjl55h2gwqdonion Dark Web Hackers for hire   http55niksbd22qqaedkw36qw4cpofmbxdtbwonxam7ov2ga62zqbhgty3ydonion AccMarket  Premium Paypal Ebay and bank accounts   https57divisqlcjtsyutxjz2ww77vlbwpxgodtijcsrgsuts4js5hnxkhqdonion Cardshop  USA CVV KNOWN BALANCE  Worldwide CC  CVV   httpwbz2lrxhw4dd7h5t2wnoczmcz5snjpym4pr7dzjmah4vi6yywn37bdydonion DCdutchconnectionUK  The dutch connection for the UK   httpiwggpyxn6qv3b2twpwtyhi2sfvgnby2albbcotcysd5f7obrlwbdbkydonion DrChronic  Weed straight from the source   httprfyb5tlhiqtiavwhikdlvb3fumxgqwtg2naanxtiqibidqlox5vispqdonion TomAndJerry  Cocaine Heroin MDMA and LSD from NL   httpajlu6mrc7lwulwakojrgvvtarotvkvxqosb4psxljgobjhureve4kdqdonion 420prime  Cannabis in dispensary quality from the UK   httpy22arit74fqnnc2pbieq3wqqvkfub6gnlegx3cl6thclos4f7ya7rvadonion Dark Mixer  Anonymous bitcoin mixer   httpovai7wvp4yj6jl3wbzihypbq657vpape7lggrlah4pl34utwjrpetwidonion VirginBitcoins  Buy freshly mined clean bitcoins   httphqfld5smkr4b4xrjcco7zotvoqhuuoehjdvoin755iytmpk4sm7cbwadonion Mixabit  Bitcoin mixer   httpjbtb75gqlr57qurikzy2bxxjftzkmanynesmoxbzzcp7qf5t46u7ekqdonion Darkmining  Bitcoin mining with stolen electricity   httpjhi4v5rjly75ggha26cu2eeyfhwvgbde4w6d75vepwxt2zht5sqfhuqdonion Bitcoin Investment Trust  earn 59 per week   httprxmyl3izgquew65nicavsk6loyyblztng6puq42firpvbe32sefvnbadonion Mobile Store  Best unlocked cell phones vendor   httpvhlehwexxmbnvecbmsk4ormttdvhlhbnyabai4cithvizzaduf3gmaydonion Kamagra 4 Bitcoin  Like Viagra but cheaper   httpguzjgkpodzshso2nohspxijzk5jgoaxzqioa7vzy6qdmwpz3hq4mwfidonion Bitpharma  Biggest european onion drug store   httpn6qisfgjauj365pxccpr5vizmtb5iavqaug7m7e4ewkxuygk5iim6yydonion EuCanna  First Class Cannabis   httpuescqfrcztbhb6tmhdlbejrjfwgtpckcoiwmwq5bfq5hhkwfioan7qadonion TorShops  Create your own onion store   httpkl4gp72mdxp3uelicjjslqnpomqfr5cbdd3wzo5klo3rjlqjtzhaymqdonion Smokeables  Finest organic cannabis from the USA   httpymvhtqya23wqpez63gyc3ke4svju3mqsby2awnhd3bk2e65izt7baqadonion OnionIdentityServices  Fake passports and ID cards for bitcoin   httpk6m3fagp4w4wspmdt23fldnwrmknse74gmxosswvaxf3ciasficpenadonion Uk Guns and Ammo Store   http7mejofwihleuugda5kfnr7tupvfbaqntjqnfxc4hwmozlcmj2cey3hqdonion CannabisUK  UK wholesale cannabis supplier   httplqcjo7esbfog5t4r4gyy7jurpzf6cavpfmc4vkal4k2g4ie66ao5mrydonion USfakeIDs  US fake ID store   httpqazkxav4zzmt5xwfw6my362jdwhzrcafz7qpd5kugfgx7z7il5lyb6adonion Counterfeit USD  High Quality USD counterfeits   httpp2qzxkca42e3wccvqgby7jrcbzlf6g7pnkvybnau4szl5ykdydzmvbidonion Onionwallet  Anonymous and secure bitcoin wallet and mixer   httpgd5x24pjoan2pddc2fs6jlmnqbawq562d2qyk6ym4peu5ihzy6gd4jadonion USAcitizenship  become a citizen of the USA   http2ln3x7ru6psileh7il7jot2ufhol4o7nd54z663xonnnmmku4dgkx3adonion Brainmagic  Best Darkweb psychedelics   httpusmost4cbpesx552s2s4ti3c4nk2xgiu763vhcs3b4uc4ppp3zwnscydonion NLGrowers  Coffee Shop grade Cannabis from the Netherlands   httpmp3fpv6xbrwka4skqliiifoizghfbjy5uyu77wwnfruwub5s4hly2oidonion EasyCoin  Bitcoin Wallet and Mixer   httpt43fsf65omvf7grt46wlt2eo5jbj3hafyvbdb7jtr2biyre5v24pebadonion EuroGuns   httpokayd5ljzdv4gzrtiqlhtzjbflymfny2bxc2eacej3tamu2nyka7bxadonion Apples4Bitcoin  Iphones Ipads and more for bitcoin   httpxf2gry25d3tyxkiu2xlvczd3q7jl6yyhtpodevjugnxia2u665asozadonion Peoples Drug Store  The Darkwebs best Drug supplier   http3bp7szl6ehbrnitmbyxzvcm3ieu7ba2kys64oecf4g2b65mcgbafzgqdonion UKpassports  real UK passports   httpxykxv6fmblogxgmzjm5wt6akdhm4wewiarjzcngev4tupgjlyugmc7qdonion ccPal  PayPals Ebays CCs and more   httpsga5n7zx6qjty7uwvkxpwstyoh73shst6mx3okouv53uks7ks47msaydonion DeDope  German Weed Store   httpkq4okz5kf4xosbsnvdr45uukjhbm4oameb6k6agjjsydycvflcewl4qdonion RentAHacker  Hire a hacker for Bitcoin   httpwk3mtlvp2ej64nuytqm3mjrm6gpulix623abum6ewp64444oreysz7qdonion Webuybitcoins  Sell your Bitcoins for Cash Paypal WU etc   httpodahix2ysdtqp4lgak4h2rsnd35dmkdx3ndzjbdhk3jiviqkljfjmnqdonion HQER  High Quality Euro bill counterfeits    Noncommercial links httpdanielas3rtn54uwmofdo3x2bsdifr47huasnmbgqzfrec5ubupvtpidonion DanielWin  http45tbhx5prlejzjgn36nqaxqb6qnm73pbohuvqkpxz2zowh57bxqawkidonion Parckwarts Website  httpskcmykvkkt3umiyx4xouu3sjo6odz3rolqphy2i2bbdan33g3zrjfjgqdonion aboutMastodon  httpzgeajoabenj2nac6k5cei5qy62iu5yun5gm2vjnxy65r3p3amzykwxqdonion Darkweb Blog  httpdds6qkxpwdeubwucdiaord2xgbbeyds25rbsgr73tbfpqpt4a6vjwsydonion Whonix  httpozmh2zkwx5cjuzopui64csb5ertcooi5vya6c2gm4e3vcvf2c2qvjiydonion riseup searx  httplldan5gahapx5k7iafb3s4ikijc4ni7gx5iywdflkba5y2ezyg6sjgydonion OnionShare  httpcathug2kyi4ilneggumrenayhuhsvrgn6qv2y47bgeet42iivkpynqadonion cathuggers site  httpsik5nlgfc5qylnnsr57qrbm64zbdx6t4lreyhpon3ychmxmiem7tioadonion Qubes OS  httpdhosting4xxoydyaivckq7tsmtgi4wfs3flpeyitekkmqwu4v4r46sydonion Daniels Hosting httpnanochanqzaytwlydykbg5nxkgyjxk3zsrctxuoxdmbx5jbh2ydypridonion NanoChan httppicochanwvqfa2xsrfzlul4x4aqtog2eljll5qnj5iagpbhx2vmfqnidonion PicoChan httpenxx3byspwsdo446jujc52ucy2pf5urdbhqw3kbsfhlfjwmbpj5smdadonion EndChan httpdngtk6iydmpokbyyk3irqznceft3hze6q6rasrqlz46v7pq4klxnl4ydonion 256Chan httpcct5wy6mzgmft24xzw6zeaf55aaqmo6324gjlsghdhbiw5gdaaf4pkadonion Snopyta httpwnrgozz3bmm33em4aln3lrbewf3ikxj7fwglqgla2tpdji4znjp7viqdonion VYempirexyz http7sk2kov2xwx6cbc32phynrifegg6pklmzs7luwcggtzrnlsolxxuyfydonion SystemLIorg  httpstormwayszuh4juycoy4kwoww5gvcu2c4tdtpkup667pdwe4qenzwaydonion CryptoStorm VPN  httpxdkriz6cn2avvcr2vks5lvvtmfojz2ohjzj4fhyuka55mvljeso2ztqdonion Cockli  httpeludemailxhnqzfmxehy3bk5guyhlxbunfyhkcksv4gvx6d3wcf6smadonion Eludein httplainwir3s4y5r7mqm3kurzpljyf77vty2hrrfkps6wm4nnnqzest4lqdonion qord11net  httpcgjzkysxa4ru5rhrtr6rafckhexbisbtxwg2fg743cjumioysmirhdadonion Course Enigma  httpkillnod2s77o3axkktdu52aqmmy4acisz2gicbhjm4xbvxa2zfftteydonion Kill9  httpdigdeep4orxw6psc33yxa2dgmuycj74zi6334xhxjlgppw6odvkzkiadonion DigDeeper httpspywaredrcdg5krvjnukp3vbdwiqcv3zwbrcg6qh27kiwecm4qyfphidonion Spyware Watchdog httpmeynethaffeecapsvfphrcnfrx44w2nskgls2juwitibvqctk2plvhqdonion May Vane Day Studios httpzsxjtsgzborzdllyp64c6pwnjz5eic76bsksbxzqefzogwcydnkjy3ydonion Shadow Wiki httpg7ejphhubv5idbbu3hb3wawrs5adw7tkx7yjabnf65xtzztgg4hcsqqdonion Defcon httpp53lf57qovyuvwsc6xnrppyply3vtqm7l6pcobkmyqsiofyeznfu5uqdonion Propublica httpdarkzzx4avcsuofgfez5zq75cqc4mprjvfqywo45dfcaxrwqg6qrlfidonion Darknetlive httpkeybase5wmilwokqirssclfnsqrjdsi7jdir5wy7y7iu3tanwmtp6oidonion KeyBaseIO httpciadotgov4sjwlzihbbgxnqg3xiyrg7so2r2o3lt5wz5ypk4sxyjstadonion CIAGOV httparchivebyd3rzt3ehjpm4c3bjkyxv3hjleiytnvxcn7x32psn2kxcuidonion Internet Archive httpbible4u2lvhacg4b3to2e2veqpwmrc2c3tjf2wuuqiz332vlwmr4xbadonion Bible4u httpkx5thpx2olielkihfyo4jgjqfb7zx7wxr3sd4xzt26ochei4m6f7taydonion Imperial Library httpnv3x2jozywh63fkohn5mwp2d73vasusjixn3im3ueof52fmbjsigw6adonion Comic Books      The Hidden Wiki    ,Directory/Wiki
Bitcoin Investment Trust  earn 59 per week,Bitcoin Investment Trust  earn 59 per week    LoginRegisterProductsEarn 59 per week with bitcoin investment trust tradersHello we are a group of OTC bitcoin traders We buy bitcoins at market price and sell them to big OTC buyers for a huge markup Recently we aquired a new client who wishes to put many millions of his cash into bitcoin using only our service because we can be more discreet than an exchangeThe only problem is we lack the liquidity to do soIf we only use our own money in the process it would take years time our client does not haveSince we can buy bitcoins and sell them for 10 markup many times per month we can provide 59 weekly interest on any money people might be willing to lend usLets earn together invest some amount with us today so we can work for our millionaere client and we will drop 59 profit in your wallet every weekFeel free to reinvest those 59 to make even larger profitsAnd if you want your initial investment amount back we can send it back at any time we only need a few days at most in case we are mostly in cash at that momentProductPriceQuantityInvest 500 and earn 5 interest per week500 USD  001929  X Invest 1000 and earn 6 interest per week1000 USD  003859  X Invest 2500 and earn 7 interest per week1500 USD  005788  X Invest 5000 and earn 8 interest per week5000 USD  019293  X Invest 10000 and earn 9 interest per week10000 USD  038585  X Bitcoin Investment Trust,Bitcoin related services
NL Growers  Coffee Shop grade Cannabis from the Netherlands  Weed Hash Marijuana Cannabis for Bitcoins,NL Growers  Coffee Shop grade Cannabis from the Netherlands  Weed Hash Marijuana Cannabis for BitcoinsProductsLoginRegisterFAQsCoffee Shop grade CannabisFinest organic cannabis grown by professional growers in the netherlandsWe double seal all packages for odorless deliveryShipping within 24 hoursProductPriceQuantity1g Original Haze15 EUR  000062  X 5g Original Haze65 EUR  000268  X 10g Original Haze110 EUR  000453  X 50g Original Haze550 EUR  002267  X 1g Bubblegum10 EUR  000041  X 5g Bubblegum45 EUR  000186  X 10g Bubblegum85 EUR  000350  X 50g Bubblegum450 EUR  001855  X 1g Jack Herer14 EUR  000058  X 5g Jack Herer60 EUR  000247  X 10g Jack Herer110 EUR  000453  X 50g Jack Herer480 EUR  001979  X 1g Chronic9 EUR  000037  X 5g Chronic40 EUR  000165  X 50g Chronic350 EUR  001443  X 1g Banana Kush11 EUR  000045  X 5g Banana Kush45 EUR  000186  X 50g Banana Kush400 EUR  001649  X 1g Blue Cheese9 EUR  000037  X 5g Blue Cheese40 EUR  000165  X 25g Blue Cheese180 EUR  000742  X 1g IceOLator Hash finest quality35 EUR  000144  X 5g IceOLator Hash finest quality125 EUR  000515  X ,Drugs
AccMarket  Premium Paypal  Ebay and Bank Accounts,AccMarket  Premium Paypal  Ebay and Bank AccountsProductsRegisterLoginPaypal Accounts FREE LOGIN GUIDE PROVIDED ON EACH SALE  We are offering the best and the cheapest high quality Paypal Accounts on the market with Balance These accounts areGUARANTEED ACCOUNT BALANCE100 VALID INFO for GUARANTEED CASHOUTFreshly Hacked Aged Accounts with transactions over 250 Fully Verified with BANK or CREDIT CARD Complete Info ProvidedUSA Personal or PremierBUSINESS Accounts What do you get upon purchaseFull Name  Address  Street City State Zip and Country  Phone Number Paypal Email  Password  Credit Card or Bank  Last 4 Digits  Last Transaction If available  Cookie File  User Agent  FREE IP ADDRESSThese are the best accounts to use for cashing out money from hacked paypal accounts or middleman accounts These can also be used with ebay or payment gateways for transfers Best for ATO and cashing out Use proper Socks5  VPN or VPN  RDP setup to login to the accountProductPriceQuantity10x accounts with 250500 balance150 USD  000579  X 25x accounts with 50200 balance140 USD  000540  X 10x accounts with 10005000 balance450 USD  001736  X 5x accounts with 500025000 balance590 USD  002277  X Ebay AccountsFresh eBay Accounts  FREE LOGIN GUIDE PROVIDED ON EACH SALE  Accounts come with user  pass  email access  cookieProductPriceQuantity20x random ebay accounts100 USD  000386  X 10x Ebay seller accounts with 100 feedback150 USD  000579  X Bank AccountsI am selling fresh high quality Premium Drops I will provide you the fullz for the Bank Drops These Bank drops comes with Google Voice Acc You will get full account access including answers to secret questions and email access This package includes Own US HQ MAJOR Bank drop account full online access  Those bank drops are not hacked or phished they are created specially for you when you order them They are perfect for payment processors stripesquareflint etc They are ACHwire capable They are as strong as your own bank accountFULLS DETAILS PAST ADDRESSES RELATIVES DRIVER LICENCE DOB SSN MMN ETCPAYMENT PROCESSORS READY Create and attach any account from Stripe Square and other payment processors to get money directly into your bank account GOOGLE VOICE ENABLED Bypass any SMS verification with Google Voice phone number enabled and attached to Paypal Skrill Coinbase and your checking account A fresh number is included in every package PAPERLESS STATEMENTS  STEALTH HOME ADRESS The accounts have complete paperless statements and all online banking features enabled You are in complete control of the account and the bank will never get in touch of the real account holder I will provide full instructions on how to keep the account active for up to 4 yearsI can ship visa cards for cashout internationallyProductPriceQuantityBank account basic100 USD  000386  X Bank account with verified crypto exchange account250 USD  000965  X Bank account with VISA card390 USD  001505  X Bank account with VISA card  verfied crypto exchange account550 USD  002122  X ,C. Credit Cards
Counterfeit USD  High quality USD Counterfeits  Best USD counterfeits on the market  buy fake USD banknotes with Bitcoin,Counterfeit USD  High quality USD Counterfeits  Best USD counterfeits on the market  buy fake USD banknotes with BitcoinLoginRegisterFAQsProducts50 USD BILLSOur notes are produced of cotton based paper They pass the pen test without problems UVI is incorporated so they pass the UV test as well They have all necessery security features to be spent at most retailersFree shipping in the USProductPriceQuantity25 x 50 USD325 USD  001254  X 50 x 50 USD500 USD  001929  X 100 x 50 USD900 USD  003473  X Counterfeit USD,C. Money
OnionShare, OnionShareSkip to Main ContentOnionShareDocsContributePrivacy  Productivity OnionShare is an open source tool that lets you securely and anonymously share files hostwebsites and chat with friends using the Tor networkDownload v26DownloadWindowsDownload 64BitDownload 32BitSig 64BitSig 32BitWhats thisMacOSDownloadSig Whats thisLinuxLearn MoreFeatures and FunctionalityYour Private Productivity SuiteShare files host websites and chat anonymously via a new tabbed interface for maximumproductivityShare FilesEver wanted to share something without also sharing it with Google or Dropbox Tax documentsmedical information or unpublished research Share files directly and securely without themiddlemenReceive FilesSet up a dropbox for anyone to send you files anonymouslyOnionService OnDemandHost a static website and make it accessible through the Tor Browser without worrying aboutsetting up a serverEphemeral ChatCreate temporary meeting rooms for discussing important information off the record No accountsrequiredIncluded WithQubes OS is a reasonably secure operating systemLearnabout Qubes OSTails is a portable operating system that protects against surveillance and censorshipLearn aboutTailsWhonix is software that can anonymize everything you do onlineLearn aboutWhonixParrot OS is an operating system for developers and security specialistsLearn aboutParrot OSTwittersphereOnionshares got you need to sendreceive files directly with the privacy protection of thetor network  need to host your own hidden service onion site in minutes viathe tor network  need to chat anonymously  need to get daftpunkback together  next version httpstcoIpYUlJLwfz Matteo in individual capacity geminiimatt February22 2021Send and receive files host a site and chat privately over the Tor network with OnionShare httpstcoYgUr1enyXd The Tor Project torproject February 24 2021OnionShare was developed by Micah Lee et al and is open source released under the GPLv3Like all software OnionShare may contain bugs or vulnerabilities httplldan5gahapx5k7iafb3s4ikijc4ni7gx5iywdflkba5y2ezyg6sjgydonion proof,Hosting & Software
Cardshop  USA CVV KNOWN BALANCE and Worldwide CC  CVV from UKUSDEFRCAJPAUNLITCHDKEUAsia,Cardshop  USA CVV KNOWN BALANCE and Worldwide CC  CVV from UKUSDEFRCAJPAUNLITCHDKEUAsia    LoginRegisterProductsUSA CVV KNOWN BALANCEYou will get a High Quality known balance cc 100 live not some rubbish cards like my competitor ones  You will get the current balance how much is owed to bank by CH  You will get available credit so you know exactly how much to charge   You will also get last statement date amount and next statement due amount just so you get your head round it in case your method takes a while you know exactly how to move around it  You will receive the following card format  CC number  expiry  CVV  first name  last name  address  city  State  zipcode  email  phone number where available  current balance  available credit    Cards designed for Paypalstripesquarevenmo no more wasting time and money trying to find a card that works with me you will hit first time guaranteed   Always bought cards not knowing how much to charge and worried about charging too much and killing the card NOT with my cards you will know EXACTLY how much is in there so you can charge it without worrying    Happy buying  ProductPriceQuantity10 x cards with credit from 1000 to 5000 USD90 USD  000347 Sold out50 x cards with credit from 1000 to 5000 USD350 USD  001350  X 10 x cards with credit from 5000 to 20000 USD120 USD  000463 Sold out50 x cards with credit from 5000 to 20000 USD450 USD  001736  X 10 x cards with credit from 20000 to 50000 USD180 USD  000695  X 50 x cards with credit from 20000 to 50000 USD650 USD  002508  X 10 x non verified by visa cards 5000  100000 USD250 USD  000965  X 50 x non verified by visa cards 5000  100000 USD800 USD  003087  X Worldwide CC  CVV from UKUSDEFRCAJPAUNLITCHDKEUAsiaFresh and High Quality CC  CVV from all countries in the world Data Format Card Number  Expire Month  Expire Year  CVV  Card Type  Holder Name  Card Level  Country  Email   Note All my cards are coming without address most of them are nonAVS Address Verification System you can use any fake billing address when you make carding ProductPriceQuantity15 x random card with high balance90 USD  000347 Sold out50 x random card with high balance225 USD  000868  X 15 x card with high balance you can choose country or bank BIN120 USD  000463  X 50 x card with high balance you can choose country or bank BIN295 USD  001138  X Cardshop,C. Credit Cards
HQER  High Quality Euro Counterfeits  best counterfeit bank notes in europe,HQER  High Quality Euro Counterfeits  best counterfeit bank notes in europeProductsInfoLoginRegisterCounterfeit 50 Euro BillsOur notes are produced of cotton based paper They pass the pen test without problems UVI is incorporated so they pass the UV test as well They have all necessery security features to be spent at most retailersFREE EXPRESS SHIPPING We are shipping from franceUpdate lowered prices for old 50 EUR series new series will be in stock laterNotes can still be used in every shop in europe only avoid banks as usualProductPriceQuantity25 x 50 Euro Bills275 EUR  001134  X 60 x 50 Euro Bills490 EUR  002020  X 120 x 50 Euro Bills850 EUR  003504  X HQER,C. Money
UK Passports  Buy real UK passports become a UK citizen now Our passports are no fake passports they are real passports,UK Passports  Buy real UK passports become a UK citizen now Our passports are no fake passports they are real passportsProductsLoginRegisterFAQsYour UK Passport  Name of your choiceWe are selling original UK Passports made with your infopictureYour info will get entered into the official passport databaseSo its possible to travel with our passportsHow we do it Trade secretInformation on how to send us your information and pictures will be given after purchaseYou can even enter the UKEU with our passports we will add a stamp for the country you are in before we send you your passport to any countryIdeal for people who want to work in the EUUKProductPriceQuantityYour original UK passport with your infopicturesThis is 50 of the final price you pay the other 50 once we show you pictures of your new passport850 GBP  004045  X NEW UK bank account with online banking and card Great for cashing out bitcoin Accounts are created in a secure way to make sure they dont get banned700 GBP  003331  X ,C. Personal
Mobile Store  Best unlocked cell phones  Buy apple and samsung phones with Bitcoin,Mobile Store  Best unlocked cell phones  Buy apple and samsung phones with Bitcoin    LoginRegisterFAQsAbout usProductsIphone XSiPhone XSOriginal box with all cables etc new and UNLOCKEDSelect USA or EU depending on which region you are fromProductPriceQuantityIphone XS 256gb Space Grey USA369 USD  001424  X Iphone XS 256gb Space Grey EU369 USD  001424  X Samsung Galaxy S10Samsung Galaxy S10 new and original box with all cables etc UNLOCKEDSelect USA or EU depending on which region you are fromProductPriceQuantitySamsung Galaxy S10 128 GB Black USA290 USD  001119  X Samsung Galaxy S10 128 GB Black EU290 USD  001119  X Samsung Galaxy S10 512 GB Black USA350 USD  001350  X Samsung Galaxy S10 512 GB Black EU350 USD  001350  X Mobile Store,Ilegal Marketplace
420prime  Cannabis in dispensary quality from the UK,420prime  Cannabis in dispensary quality from the UKProductsRegistrationLogin420prime  Shipping from United Kingdom We specialise in legally grown strains of dispensary quality All our products are imported directly to guarantee you the highest quality from some of the best growers in the world We reflect this in our prices and believe that ensuring quality of product is far more important than cheap prices We are professionals not street dealers we do our utmost to deliver on our promises on time every time Basically we love cannabis and we want everyone to be able to enjoy the finest quality regardless of outdated laws trying to prevent it   All our packages are shipped safely and discretely using the perfect amount of stealth We offer Signed for next day guaranteed delivery by 1pm or royal mail 1st class 13 days All orders placed before 2pm will be packaged and shipped same day  Shipping fee is 5 GBP FREE shipping for orders over 300 GBP   ProductPriceQuantityBC Cheese 7g80 GBP  000381  X BC Cheese 15g140 GBP  000666  X BC Cheese 30g220 GBP  001047  X Blue Zkittlez 7g80 GBP  000381  X Blue Zkittlez 15g140 GBP  000666  X Blue Zkittlez 30g220 GBP  001047  X Ghost OG 7g80 GBP  000381  X Ghost OG 15g140 GBP  000666  X Ghost OG 30g220 GBP  001047  X Pink Kush 7g80 GBP  000381  X Pink Kush 15g140 GBP  000666  X Pink Kush 30g220 GBP  001047  X Purple Candy 7g80 GBP  000381  X Purple Candy 15g140 GBP  000666  X Purple Candy 30g220 GBP  001047  X OG Kush Creme High Quality Hash 15g85 GBP  000404  X ,Drugs
