title,content,category
wwwparckwartde,wwwparckwartdeI do computer stuff As a hobby and as a jobI also do other thingsMy email address mail at parckwart dot deDisclaimer Some of my friends and family have email accounts in the parckwartde domain Any email that doesnt originate from the above address was not sent by meMy OpenPGP KeyFingerprint 0x47BC7DE83D462E8BED18AA861224DBD299A4F5F3Direct links BinaryASCIIBEGIN PGP PUBLIC KEY BLOCKmQINBFivQ1kBEADGQjxp1Fl4qFUZ5lCwhcg77KIv8P7CzkvL1FheaxD2UXs3moubBYVdJOAvD9X69VaW2rhmjtfYqnqk8mJSctnKxQAFyoTKCzIBp2pMe0pOyKTwZDY2LlOJPUaTuH5uirROHOQsy0CO9TVXFsoRjZpve2gCHbCzsben5A6SLswCzuRcVlyxc9BA3lK0zBC7TjZKdMaI4CLHSm08fgnmOrNuZUEwWLwseQhxhsCQkTgl27OUOEltg70aXgD5yzOvhlPWhbQLsS6HkpvB1sU4eu4BTk1ThNlkTwQcnPDwNOMTYL840wWD36NWHLpawvnuSeBJSMJKH4svPvbOkcCt6gwuowzQj8jMv1UU7346obfbw3Etu1YBOcst2Fqkyk4DMZWyIuiN1pFyFeRQgtF7FJHUCJ0PsqxqHoZpk5vFVaBHutZ7lMFZm2hCX2KDPygIQZcaQ840F0WEyVPIRIn50ZYDSWur0pIj51QNuVktEEhNRowEdpeko0mozgxzAOTwCIvZiSvauOpbW3U2h0s24n0GNn1KJ1cmVxPDK9WuYAiLYGPnYpD43dpSFrB8QBj5QS0nRQIpI3NlCzNj09QUaRhEd6QnwYKM5NqCIdhwjtcZgbAxgoRHAjAVJSkYpyxn35qIf02f82zgU6jYiQDISLTbybQARAQABtFFKb25hdGhhbiBNYXJxdWFyZHQgKFVuaXZlcnNpdHkgYWRkcmVzcykgPGpvbmF0aGFuLm1hcnF1YXJkdEBzdHVkLnR1LWRhcm1zdGFkdC5kZT6JAk4EEwEKADgWIQRHvH3oPUYui0YqoYSJNvSmaT18wUCXYtT1wIbAwULCQgHAgYVCgkICwIEFgIDAQIeAQIXgAAKCRASJNvSmaT18oCEACHUwKijPhLichqYDyXjSe22rO4fdXEyCiQfGOE7FwIRHB5eMhwlR8E27dinNU2CXM8giGQVAKVvJagnOnO9mvV4N6TzuQ9wyeVigKm1QY3xAhv9CgvrOf7hlyXmxjcOY80XloZgi77P83BexVv1U43u3oXqYIwobkI1xmCuGV7kgL2Wwfdnxk4AVvqCinj1yJcJ84RARsVpJsJqbUiVDpWiQxr31ob8cdKMrD2Xak0DkN0WNHRewpoTtCikIMtQvywaBRYHtJEySb2lBUKSEri7nzYxfCIwrFOe77LWiKIXDOiFMdF0zO3K1pNGZZZQgkLJzDDWUhbxfPZthAf6O9WhRNYBdUn5IBkyc6n77xMEDXC2kNz3qZc5Jf1ld6vgxIUfK8uAAczDZcwH2tpGboM4WOhB8wwTD4NEysvf4WEhDIbawMvBAGTikkWeiTn9MGaSYog25YAMiW7VfYO0A2tzDR06OVgCBJcfKyP04keNYbmco6f3CkTr5HzDnRj5wJjis4QDIFpj47taMWEVhtBnPHFR7zFtfhvqJof19lWUxqQlkjBTrBAAPzdKELuFVD8SJqLYjrOV7KPF29RY6MFvdr7OJ7pTlDpYcEdKx5WZXCL9r6Uu6GKKa8sH9mGBxGK4Brchw5LEq6wOcbQmSm9uYXRoYW4gTWFycXVhcmR0IDxtYWlsQHBhcmNrd2FydC5kZT6JAlIEEwEKADwCGwMGCwkIBwMCBhUIAgkKCwQWAgMBAh4BAheAFiEER7x96D1GLovtGKqGEiTb0pmk9fMFAl2LVsoCGQEACgkQEiTb0pmk9fMAewTZnDoe0pQQQ4bQYcoH0WxlQqiBCiTutFMPzmublrnwngziytVUQJlWD1hsLo2gyQfXRvpbYPscTv9SUZhwHRJ5GUGWfSKh1oHtQK9PO7fs2GQnz4RAeh2a42EdUnbifSI7Zx0guOmdXz9WbnLRo2b6mHvVI0oIIr1RIfenwjzHK9JQpEkpGccFI17jaT8dfPeGTDxaBH1f5RNtU3UFnHrP9JkdCRMMhg319VDlLx6o56GvT38KF7vq9GbuFx79QcHTPBKRZ8DIU7OpCO2Y78PbHUqt5AyNL09aPTnDmqLraDEE7VWIXS9USeVYFeMMiJlsXbOZzHLggEZiKQH8lTQeDbr7xLmMKPXDeYFA6trkSydwaUxFeVkxoGCIugSIpH2Nhkip7th1AEC2ctHeXBXQNcMPw2sGwy3ifuIegTbYKPM1NXzwkKqtBuO1cYrdgsCy8LJRmFOm5ovGWUXtxjHRawhRq1obV7gpbgUVlpCL9PIYmPbewMYRPtMV6qGw1340RJsgkZ33wd6hwXTA1PzuZri0M9jCjWVGO2wKeuYT1N2nRs1x902q9y5F8Oj2ekw3QK6kgcE89nqILDUEKxEPOStFQeEGEWC2s2LD0L6Rpr8SpgmapW7Lczo7EYJZymeBSWaivDoKud26nXFb7OmJAhwEEAECAAYFAlivRngACgkQCC0vGHmN5XVhjw6AoeqJnxBLhKlYeFduVJkZw8J0wbbVunybHjsknfihLEOOBB66GD7YWQewOgDKR3Vg8MLzHCWmsmZUCPcmiKB5jQwP7QmGBhirss7k5FcjwnBVWzw4psVPsFr8O1gM0hFM08SRlY3K7TMjqCeBsZfQu0Bh1jVoMJQQkYnCvUogWivhM0LmNCGTpE0ifdtJwYkQk0RSI4Uq4rPUqAHYDy5irgjHLlo8qbznTFB7dOvtCIgfAAd5oZcPGmkKzHo8yQkfm7Vxg0V75xV7j9BiFBk7XBzRUhfvij7v2TqzyjaT7BRxOikum3Vuj1gsjxhabrAPPVbPc3GxeZWVuIEvGvKktxjSZUlCfSQhkdLqofidqeTHw6p3QnzcywwISgE7Mhybd5rQEpjrDmGZDbNSpEWvWtPh3FIE74nORBMnPM18VB1pNfpTkzxQLXPThO3V8xIxgzkrEEEyUqzFx0phCRFnvCmFSQM99wHbPp0uc9aEDRGq1KaAkqThK1m3aw42hDe30PXAQBcbq8933Cpd6JWBoXPsmvQREaIWjClpvkq2GJPW2xGuPdi7V27tnuKq75fJb1zA9lnkO72J7fki57ma35UJ1TZpyLPZgHXmMomlfwoYS19xydZvBF1Hdu6qdU7cydsO76cLcWAJbY10ISJAZwEEAEKAAYFAllQJFwACgkQ13YN2a9sJ2OQwAsBQlJ4mEXgCSluUCYpHt0MOCDxrwlTfWwse5aVvnKtCzD7eedtzucWW8ZANHVg2XqLIcOYmoj26EEzd6T14mYwLmoQeFozVP2Q6osvS224ywxMGMtgtbKZFqgnjLc8ctUM2Xzuo184TuDXxD99lnMI88fvbfzgaMAoiGQZl6LqetJJIvlBS10Dge1HKFKDWdSTg99mcPWrH9TMKaCltWCTTV0mQ1KO9gaVToiBoAt0gxZiiwkCIUW7Wa2DO5qddqZTj0UB9Q7Oo65Fun6Ds6WKSRHFkMuNJOFc3ds26ElhdEBCwf9gAswqad4cQNqYihCwSlfQ708HZTCfWLrpW0EPw3HoTCIj4UpURb5WDlXYqbm5Dh6I4vucZ8ac0col0R6pjEKvvccYR5Ag1j2eo5bLYx22RsoZw4u8B8lpON6hUNFjpvWuKXznk5Ul5aWXP2Muy1g7hlMPHz3CyP2Ssomk0KhmyjG3QFNTKHcyBarebrJP2PiQGcBBABCgAGBQJZUCmQAAoJEAdyBU6Hhya4lGcL3pJNHE7vjLgbTCsHnEwJXorzHSQInCG1IVEmhbUzXVYYLmVsFgFX7y3SCMRZrCDIWIAYYldocThGSe5gFZFaVfrc49b53KwBQG2LMRKyuMcqtoBtfCvg82Ii8t5wPtgluj4RcC78KxGBq13pmmCIZqABflzenWwt4myyNMtZ9Sg3bkUG24F8AppIz69KmbKpNKgy0zoTMLR2i643H5BUDHkHd6PeVaIET2akxwPzEurydczAySOchvaUVSPslAd6L4WgsHp9I8ZOfDUk4jzgG8wcC8zE2uoWJlM2kujPcSN6ZYF3FCg6QrjtNaV0OCN8iWKj4X1RHMGWwCyN9lBR6lnPlesGXMzEMlBy8FWO7xM2OKEhtabMkZjlTCQT5H4VQkVsRYLIotDF8hzmYC1Aca361Y4CwwzPFWqQ2ZMsQzO0HJtpZsMo1gaMeuBJXXP2hbRC1JASThF6KnGDtGklVrLL6MyGOemupeIkTyJW2PzGG4kCHAQQAQoABgUCWVAkJgAKCRBt7lk2qrEaDD2D9RmEUzl1pyvdglpqzmjwilLZhLUWTHZhWLhZERtLwlFBecbTIj1yOs4DbGRK5DnVCvNVSJT8vQcMUjcgUeY2sDz6kaxrVouq8bk8NfxUOboeRBvUhUEOE7acDfhmZZO6xoFhaK4QFK7kyfxHMSJj2GRBCPJzwkyAD04skBSWoIk29GiaGkv1Kxi3NGGGvtNWyjDukGa1mrL5CZAOFp2ach7Qhq4dtMaY55CeWSDnLLBp5fqbVcCNO4JlvWK4PMbvpFLCIGOOIk0mEoXpFbU3Q1NNCLUUwNRA4vQmGBSjXoiatf7YXInnU531fZt8Lp4xqiRqVHrz5oKsRbn2M00hzM2cpA9UuEUJ6ybsrwFykiej9nqPtvMsYdWKeVtGXdWCZ92sgCOWuH7WTCrIT1SPJT3JvmkDliXwMKBHhe7aSZhLisFXmEsTp10YmIfM1qJoMEHmWzLNiR22ayoz0X6b2EqtqPT3tU3l49ljvQEsCruIVj60iGfCZ6KHO3ktN6opHhOTTgaKT7I6opqE6bbznVzTPNf01nDxDY4PMbBrvfazHsJqRraEqOj3sDIuVkPlILMa25PxtFq2eAJ9nRlCgpRkMaKl1Yq3g8XOY6unyaMB3U5DvhaBfKuZZfUFX3wiFWzVO0F1fCHhv1Jez1uGbI4kCOQQSAQoAIxYhBO22T6L3kGd6kKX9jjbDVqWm6mZ2BQJag88cBYMHhhAAAoJEDbDVqWm6mZ2NDUQALz3bZJG8PhasPWNmQrt4Ak5NvC4CaAf9SQgtbOg3P7Hy8SD6vvJdfY7xr3QCnvhyjTGqmPlBBAusXlzbPFtvsPwjljVNdjvcKLovKykvZrSzxcoV1HKncD7QiJUnBW4SDTVKZ3z3AcctInwJCNkISMhjHbn33woczLN5W9KvUkcODMCFx5VMp6wqf3md6TyZcGHQAmc6fsoUCvhMUqTO8n1jJ2pei1RgFmAz7mMUaISI3qSCQbzeKhpBkeOs6FUfbwBNb7kiQB3YoJJA2CP82rsL2KMWPZDTNnPGrJQQ90EfR2EeHsou1KiVUtGHgnEOgWntWsXs0MtCuVgWPlyXsKZFChqHkZ9ZJfuQzZ1Z0KEurbzpW567rc9PdmtuOeF0znJFJE6JYAMPdChdBPFBqnTDPVrSSgfuiyP1X8jDCF52fFXZ8IK7VuOrpw4Ioo1V6XzUy2n4gqKj87StgHpsoeFkBjKvJ6frEqZ1bl7fHiiOoOgFVvv8YgwqaVYvJ92sTpsP7Jn7rxhk2erCeZNcftwBPlMiE6TRHnPIQ4WivsMRmiukg1D5qvyeIea6jo7MBII19s6KLJeax6ViNAzHmzObME92bjqYgZ6TEYyWedpmvro597vhg1JKbmXAeQThO1bJ2BWH7ftyS2pjQIiBGU1caiQGzBBMBCAAdFiEErPv3ib6yM7wBGmAob3WsVnWSgFAlvoOkkACgkQb3WsVnWSjgWgvIqWOJiGQjvohBa1Zh64IllGm2ujS55eTsPfr12YeG4VXDQ7yNBqZQOySjMjINIZI6WFyrquDHhDbqjtK4lD7MDgqkzD9hntMhLA2OJanX8b8zro7KmPkSIDeKZiD3yszHt7VE73G8k6CbqSyMopsQllC6DEEOKLPppGRprvLNDJV3Tq8NfNqSiI7KR1DD660MsMVndMNaBbhAM2ocEG4QBDSWVpgHvPLONCIFmzpJa2clR708NV8Z3SLMLCIMQfrnGHcxyNq38Pw4LAXei6KyLTsBBtuPOevMQ4WojukmMZuWzRPGeLbS2UbNZacXW6HrKnT7mJGMNyaRkXuMoiCSxVvOI6rGdCiMwzNlZbM9cUu9S2iJWHCLYEJFIl3pWNB4TnI0EUbWUnMli7DNP7vVDUmegsDYHDhIxfWZeI23Iw6SltWGAJ2PKTarOdQzPxIEdBg4aleGKWAxTerox1ozWlV0QPUbsgmwiCdrlEuLFAARFU1yiQIzBBIBCAAdFiEEV5UHHFBSTqTMxpNIUYer6TbFcFAlxPdt4ACgkQNIUYer6TbFeqjxAAgQ60uUo7nn6loU08pZi5Ip8WiBkcpgv4ACXWray5eo5E820OBfHuFObzL9rlUYwjEqJsPjQyaKVD4M1zLgfNZrSPzJ8v5mssudbFtnPmusP3N8jM9S116rSYow9hX9vb930eoaCaduLYbAPfwJZe99rX3s6bSeuXR5SlfXGvvmJW5ojZ3KV6oXyM9yVgdEYURZJnzeeohXcxU9NAUhZXh1fyTQOt0KbRQ3bd1A6syWCEnEl0voVOGDDpCS3Om1ERk1zeq5nIqlEOMvc2bIrUQQNJc16o2bl7Ffq3dA0C6V7NRXMGTMknyfGISy5QhkPPxxuKL77Jh7i097mjBaU3BO1f0LpVTk7pFCuLRrpXW5ERML7hvASbPGgQaTHF32j9SXgQenJZ6Cbum5q1DVbNGRLHHamijvrI0yiwoqQZojKmzVQGtrcRlX7H1dPpeFLK6EwDKZqTRsz1V4M5uKF6d39ERDuxN0aNXgKIsmFTrdrn1T5Sb2EkenNaRednXCVsgAKuvilm0yr6QCLHDhn4s31scaKUwaZvL98wvxlcWB6LZHOJM3WoqediBBKwWrJp9GzdKrQKgiWI1Ap8s8kI19nFlXgqyGTFPnXbt2ktuMfWAJke2Fc1b8YGSPRlZQGwLWlZym9TxUPCJAjMEEgEIAB0WIQRdUC6zs9AWvfJ17BVc5Rh2n6OiwUCXFDtMwAKCRBVc5Rh2n6Oi2v9EACA7mCYEC4FSNuOHU0RnmZEupbkzulfgZGNcuXngiLLspR0C0st0fbH8oIC1O41u8Y4JfPlx0rZkZGb3UDds6vw67tUo31YfTE00afv3GjtofJLsJi70WUQLAZtFTnlZ2bx3w7QdafqIOZcNhcJMBABC4aWCAuPqPr4el9ITxCzFrf6WcSvzSxJa65HUar8fWk86Mm7NSC9TjbxdsxmzYle4C4wBQaVJoH5xvz17Gly5ylcFtHA2swwIn2WDL6DDavfLRTk7YZ50jinzEFgvKUHktQYdeIcfLH6NWiFwTxtcI6W8VJAAohJeiqKkSEpZslRaOmsXBP6UPvXzXPRTgWhr1bRXyIuRASnfyjTWQecPfsLWfluZVFKDOtcPGmAEZgGd4GYLfgomBpRjLmhnnMPKy3SWutTKpBtUKf62s5bo1ltRLhP1eloH8qIBhwftPaU7b4XFP1I9HVoZCcEsCBvKa7cz6Ov4dRFWC4iQl4x2ILm3L3KcqpRnadDuhCEDZsUFBvGHGug5F7HcaNbHYphVKkteMcagtFH7Q78N9kqQVrVLgUQx5XKBh7FFfTwjMv3jXsGdEH9B9NDjDb97e1pLdMYMlMUPuvyhDhPLIL8JUJO8Pj7dgg0mbtMly4H9MOrJzEsZkftovryyQI4kCMwQQAQgAHRYhBPZc438Euls2CubuF8IYUlgZ94RRBQJcVbsAAoJEMIYUlgZ94RRqpsP0qOVCr5sEein7jM18XjKo7uebVISW6ImYnNTq2Go7oA5FvmE8wiEWGqA97VovfXm0AYtpuGhurx2e3ns25T7BJl16r52Qq7tjfGxKHlLiS1JXRgyN2GACUXo8VcrSBbjHdeYeiaX6K3RiScYXEi6teuLvbtdcwiy3AIkpY85X30Y0fgEUSyUoxLuCT3xw4T48oPQc7S6XqmpOFuVSzN0dJkIg9iJ0HFNqAoZ2PcjWfLRdvG9XAO6DW95TZbXaVMSbfpkPTu3XXABlEDRiodUZMBPQPkHCs3SqVTCjUOLZJDOX4OHqRPgYqEL1FOwGmjWo3tSeRKHPV3H0MnqpeDQ1zQ4Xes5kFWWqEdMyPWJQ7CpxKJgInA4RLZrvbxu2kw0i977uNr53EUjf8CvZIXkvTImBpZVmjIF5pTBAqPbIESKhweKevQphPmpf6AnMPAFxrurotC7agdLywqFPUodMObeFwKq5HjEPZCRoIThRwPQKI0yh8qW83ONf9ARckY3Ewsgdae3uuTA79JhCgv3zMAnovBL3zSkju559YHh4QcJgm1q4diQuN0WgIHKMkTYt0yJieCeZ7ls6vH8NJ7vNqxgdyekfmC7SO8wsQpZzsHlgfudIOMC99lgox45SRQJoOZRuUipJ1Tx7FrrMShkuQINBFivQ1kBEADxVr70t6M8EYwa6fJi2zKM4ajqTCy7ZiIHrqqN99oiXoAqB3wxpawcZAO1FEWE0COUqT6ftDrOUYmnhraAFl2HrAtCAfdpSxARKMc1lh5u1u07tU87kSthHfKOy42AgMG8pXaxVGdXW3u6Wg91XIfxZjwGKNtiv6Zsc3U95jtLomOgGbvw1uK87Zuq854nmb6iWRWfdjHRLgXkEnOBmsiR3N1mT2cSoj6HPQd62ctzT76sm3tlZKk0sOv5GThwVgIfcwIFWWe07pIsF3oUXTLcJXoPCeAiTreiTfjrBTgSwup8JapLW5NFtz3KqVV95fsL1crwSPkDJvAN8NDoOsvlMvAh5IhIJpBB5yu1TjBS4luLj3cO02DmyMooLOCoDpwfYcnMdZgP8c2kMzBX3wm8omXDZQFCDzqTBIaiDX3M6nWezqY3ejahY0flUmSBoKzzarBFTNhgj9wwMHjI4nqSnl4EgDLFjFg0UmJFVYPa4uJ2DMjh8Mrl7N5Vnm1S3JuFw7iVcA8iXJXRMEGWSHdlxMUdoCZvUrYGJy79S9YCdxNBRksOiNfnvHMhfsUofFW3HhnIW7uBHTELeOGnKcuEh7oMSTz6CrlRKOcwB7IMFvaz39JL55jQ41F98WWyTJBa81kGGizqMLeYzgecyM8wX3uwARAQABiQIfBBgBAgAJBQJYr0NZAhsMAAoJEBIk29KZpPXzzosP1D0TEddsSg25UCdzDJmGAMGHKnoL3Tt18Vgr0llF084Bq591PU1iJ1edV2WezrTWiUMScXuwRcIbE61UKlkWpnPKu7A4530GF0Qf6c9QQKamOnklcZNyW1AfVpi0h9SnACtPq5tmqUxggqjuUqAwKTrAzBszFIixV0zGIctGaFLwEOfrcWsTVXRtbgPgzqOO3suipB3gr0LNgJfQaB2C6J8TLltd2tFBWf09tB0K13jix87GAd7uguyZCkoraHj8SilYo85ODxeuQzr8AALIqPY80WI0NgOyI8fHwpPQcFQSU72EPvNH0weze2eMLCpgChpByuHalfpapYZpTarEV12iaezSCCdeKlqfMTwf2La75kyaRu3ZnNuQlrhJ3P6V8OT7HL3wG9mOb8pD0q00Ram8Ds5irFL1NLPnyGy84xB6hZWtt1x2s5O9mLClgXSFNBu48LS69gsQNphPp5VBqBXffYPEdXIOtuhYRdc1rBMe01VKpTPJHc0A0dKdm2GqqwNwlswpiH0H3wF0uG9wxCdZ6wihQX5IcTGsXmqRPQBLdKT7tr6D8d42YqFhffh641bFbSWkciHcF6LBjpmNWwceEL1i1jo5NFqXJrBxWQ0o4IThy4dalzDE5Kc2kLOmAfB48EvYe6ZcKE8f8NmnzEND PGP PUBLIC KEY BLOCK,Personal
Euro Guns  Number one guns dealer in onionland  Buy guns and ammo for Bitcoin,Euro Guns  Number one guns dealer in onionland  Buy guns and ammo for BitcoinProductsFAQsRegisterLoginWalther PPK Kal765New and unused and unregisteredAmmo can only be purchased if you also buy the gunProductPriceQuantityWalther PPK Kal765600 EUR  002474  X Ammo 50 Rounds40 EUR  000165  X Desert Eagle IMI Kal44New and unused and unregisteredAmmo can only be purchased if you also buy the gunProductPriceQuantityDesert Eagle IMI Kal441250 EUR  005153  X Ammo 50 Rounds45 EUR  000186  X SIG Sauer P226 AL SO DAO Kal 9mmPNew and unused and unregisteredAmmo can only be purchased if you also buy the gunProductPriceQuantitySIG Sauer P226 AL SO DAO Kal 9mmP790 EUR  003257  X Ammo 50 Rounds35 EUR  000144  X ,Ilegal Marketplace
Kamagra For Bitcoin  Same quality as original viagra pills cheap prices Bitcoin payment,Kamagra For Bitcoin  Same quality as original viagra pills cheap prices Bitcoin payment    LoginRegisterFAQsAbout usProductsKamagra TabletsKamagra 100mg Generic Viagra Tablets are a very popular successful and widely accepted treatment for erectile dysfunction Manufactured by Ajanta Pharma in clinical clean room conditions Kamagra is produced to a high quality standard to ensure safety and effectiveness Patients using Kamagra regularly report successful intercourse and generally continue to use the treatmentThe effective treatment time of Kamagra is 4  6 hours but many GPs report longer effective timesThe active ingredient of Kamagra is Sildenafil Citrate It belongs to the PDE5 family of vasodilators These drugs work by dilating the blood vessels in the body particularly around the genital area This in turn allows stronger blood flow to enable an erection to take place Kamagra is not an aphrodisiac and stimulation will be required to develop an erectionProductPriceQuantityKamagra 100mg x 1215 GBP  000071  X Kamagra 100mg x 2428 GBP  000133  X Kamagra 100mg x 5250 GBP  000238  X Kamagra 100mg x 10078 GBP  000371  X Kamagra Oral JellyKamagra Oral Jelly is a popular and effective treatment for erectile dysfunction Unlike hardtoswallow tablets Kamagra Jelly sachets can be simply squeezed out onto a spoon and swallowed easily Kamagra Oral Jelly is manufactured clinically in clean room facilities by Ajanta Pharma Kamagra Jelly is supplied in a range of flavours and quantities may include mint chocolate banana orange mango strawberry pineapple and vanillaA selection of mixed flavours will be sent in every order Unfortunately we are unable to send specific flavoursKamagra Jelly is quickly absorbed into the body and patients report faster response times from 20 mins Kamagra Oral Jelly has an effective treatment time of 4  6 hours but many GPs report longer timesThe active ingredient of Kamagra Oral Jelly is Sildenafil Citrate It belongs to the PDE5 family of vasodilators These drugs work by dilating the blood vessels in the body particularly around the genital area This in turn allows stronger blood flow to enable an erection to take place Kamagra Jelly is not an aphrodisiac and stimulation will be required to develop an erectionProductPriceQuantityKamagra Oral Jelly 100mg x 718 GBP  000086  X Kamagra Oral Jelly 100mg x 1435 GBP  000167  X Kamagra Oral Jelly 100mg x 2150 GBP  000238  X Kamagra Oral Jelly 100mg x 2862 GBP  000295  X Kamagra Oral Jelly 100mg x 49100 GBP  000476  X Kamagra Soft TabletsKamagra 100mg Soft Tabs are an alternative way to take the popular Kamagra treatment for erectile dysfunction Chewable and easy to swallow Kamagra Soft Tabs make an ideal choice for anyone who struggles to swallow tablets Like all medicine from Ajanta Pharma Kamagra Soft Tabs are produced in clinically clean facilities to consistent standards Patients using Kamagra generally report successful treatment and continue to use Kamagra Kamagra generally lasts for 4  6 hours but many GPs report longer effective times The active ingredient of Kamagra is Sildenafil Citrate It belongs to the PDE5 family of vasodilators These drugs work by dilating the blood vessels in the body particularly around the genital area This in turn allows stronger blood flow to enable an erection to take place Kamagra is not an aphrodisiac and stimulation will be required to develop an erectionProductPriceQuantityKamagra Soft 100mg x 1216 GBP  000076  X Kamagra Soft 100mg x 2428 GBP  000133  X Kamagra Soft 100mg x 5250 GBP  000238  X Kamagra Soft 100mg x 10078 GBP  000371  X Kamagra Polo TabletsKamagra Polo tablets are polo shaped and come in a handy tube of 7 Kamagra Polo will simply dissolve within a few minutes and can be taken discreetly Kamagra Polo is manufactured in clinically clean facilities at Ajanta Pharma and is supplied in mixed tube flavours including Strawberry Lemon Pineapple and MintThe effective treatment time of Kamagra Polo is 4  6 hours but many GPs report longer effective timesThe active ingredient of Kamagra Polo is Sildenafil Citrate It belongs to the PDE5 family of vasodilators These drugs work by dilating the blood vessels in the body particularly around the genital area This in turn allows stronger blood flow to enable an erection to take place Kamagra Polo is not an aphrodisiac and stimulation will be required to develop an erectionProductPriceQuantityKamagra Polo 100mg x 715 GBP  000071  X Kamagra Polo 100mg x 1424 GBP  000114  X Kamagra Polo 100mg x 2135 GBP  000167  X Kamagra Polo 100mg x 3549 GBP  000233  X Kamagra Effervescent TabletsKamagra Effervescent Generic Viagra Tablets are used in the treatment of erectile dysfunction and contain 100mg of the active ingredient sildenafil citrate Simply drop one of the tablets in a small glass of water and stir gentle Within a minute or two the tablet will complete dissolve in the water allowing the patient to drink the solution easily Kamagra Effervescent disolvable tablets are manufactured in clinical controlled conditions by Ajanta Pharma and is supplied in a tube containing 7 tabletsThe effective treatment time of Kamagra Effervescent is 4  6 hours but many GPs report longer effective timesThe active ingredient of Kamagra is Sildenafil Citrate It belongs to the PDE5 family of vasodilators These drugs work by dilating the blood vessels in the body particularly around the genital area This in turn allows stronger blood flow to enable an erection to take place Kamagra is not an aphrodisiac and stimulation will be required to develop an erectionProductPriceQuantityKamagra Effervescent 100mg x 715 GBP  000071  X Kamagra Effervescent 100mg x 1424 GBP  000114  X Kamagra Effervescent 100mg x 2135 GBP  000167  X Kamagra Effervescent 100mg x 3549 GBP  000233  X Super KamagraSuper Kamagra is a new form of hybrid combination treatment for erectile dysfunction and premature ejaculation Containing the active ingredients Sildenafil Citrate and Dapoxetine patients can experience a healthy erection and more control over the length of intercourse Dapoxetine is clinically proven and approved in many countries to treat premature ejaculation and allows intercourse to last longerPatients taking Super Kamagra can expect an effective treatment time of 4  6 hoursThe active ingredients of Super Kamagra are Sildenafil Citrate and Dapoxetine Sildenfil Citrate belongs to the PDE5 family of vasodilators These drugs work by dilating the blood vessels in the body particularly around the genital area This in turn allows stronger blood flow to enable an erection to take place Dapoxetine belongs to the family of SSRI serotonin reuptake inhibitors It is the only drug with regulatory approval for treatment of premature ejaculationThere are additional warnings and precautions when taking Super Kamagra Please read the information below carefullyProductPriceQuantitySuper Kamagra 100mg x 418 GBP  000086  X Super Kamagra 100mg x 835 GBP  000167  X Super Kamagra 100mg x 1247 GBP  000224  X Super Kamagra 100mg x 2470 GBP  000333  X Super Kamagra 100mg x 52140 GBP  000666  X Super Kamagra 100mg x 100220 GBP  001047  X Apcalis TabletsApcalis Tablets are a popular and successful treatment for erectile dysfunction Containing the same active ingredients at Cialis patients can benefit from an effective treatment time of at least 36 hours This allows couples to engage in intercourse at a natural time Apcalis has been previously supplied under the trade names Kamagra Plus  ErectalisThis longer effective treatment time has gained the drug the nickname Le Weekender in FranceThe medical name for Apcalis is Tadalafil and it belongs to the PDE5 family of vasodilators These drugs work by dilating the blood vessels in the body particularly around the genital area This in turn allows stronger blood flow to enable an erection to take place Apcalis is not an aphrodisiac and stimulation will be required to develop an erectionDue to the lower overall dose of 20mg many patients report lower side effectsProductPriceQuantityApcalis 20mg x 816 GBP  000076  X Apcalis 20mg x 1223 GBP  000109  X Apcalis 20mg x 1629 GBP  000138  X Apcalis 20mg x 2442 GBP  000200  X Apcalis 20mg x 5273 GBP  000347  X Apcalis 20mg x 100125 GBP  000595  X Apcalis Oral JellyApcalis Oral Jelly is a popular and successful treatment for erectile dysfunction Containing the same active ingredients as Cialis patients can benefit from an effective treatment time of at least 36 hours This allows couples to engage in intercourse at a natural time Unlike tablets Oral Jelly is easy to swallow and is very quickly absorbed into the body Apcalis has been previously supplied under the trade names Kamagra Plus  ErectalisThis longer effective treatment time has gained the drug the nickname Le Weekender in FranceThe medical name for Apcalis is Tadalafil and it belongs to the PDE5 family of vasodilators These drugs work by dilating the blood vessels in the body particularly around the genital area This in turn allows stronger blood flow to enable an erection to take place Apcalis Oral Jelly is not an aphrodisiac and stimulation will be required to develop an erectionDue to the lower overall dose of 20mg many patients report lower side effectsProductPriceQuantityApcalis Oral Jelly 20mg x 1020 GBP  000095  X Apcalis Oral Jelly 20mg x 2038 GBP  000181  X Apcalis Oral Jelly 20mg x 5090 GBP  000428  X Apcalis Oral Jelly 20mg x 100175 GBP  000833  X Apcalis Oral Jelly 20mg x 200330 GBP  001570  X Kamagra For Bitcoin,Drugs
Apples 4 Bitcoin  Iphones for Bitcoin Ipads for Bitcoin Apple products for Bitcoin,Apples 4 Bitcoin  Iphones for Bitcoin Ipads for Bitcoin Apple products for BitcoinProductsFAQsRegisterLoginIphone XS and XRBrand new iphone XS and XRAll phones are factory unlocked and work internationallyPhones are NOT reported as stolenProductPriceQuantityIphone XS 64GB Space Grey325 USD  001254  X Iphone XS 256GB Space Grey400 USD  001543  X Iphone XS MAX 64GB Space Grey325 USD  001254  X Iphone XS MAX 256GB Space Grey400 USD  001543  X Iphone XR 256GB Black350 USD  001350  X Macbook ProMacbook Pro 2018 only limited amounts availableProductPriceQuantity15 Macbook Pro Touch Bar Retina 29ghz i7 2 TB SSD 16gb ram Spacegrey850 USD  003280  X 13 Macbook Pro Touch Bar Retina 33ghz i7 1 TB SSD 16gb ram Spacegrey600 USD  002315  X  ,Ilegal Marketplace
Mixabit Bitcoin Mixer,Mixabit Bitcoin MixerInfoLoginRegisterMixabit Features High volume mixer and always a perfect mix with other users bitcoins there will never be taint to your old bitcoins Safe storage we keep most of the bitcoins in secure encrypted offline storage Protect your funds with a transaction PIN Anonymous registration We do not need any private data Very simple user interface no complicated options and settings For small amounts up to 001 BTC there are NO FEES except the bitcoin network fee For larger amounts the fee is only 05Mixing best practices Always wait some time before you withdraw and do not withdraw the same amount you deposited at once Ideally just use Mixabit as your wallet that way there will be no timing or amount correlation between your deposits and your withdrawalsMixabit Bitcoin Mixer,Bitcoin related services
EuCanna  First Class Cannabis Healthcare  Buy weed online Buy medical cannabis online with Bitcoins,EuCanna  First Class Cannabis Healthcare  Buy weed online Buy medical cannabis online with BitcoinsProductsInfoLoginRegisterBuds  Oil  Ointment  Suppositories  Creams Bath MeltsSoaps CannaCaps  Edibles   Special OffersMedical Grade Cannabis Buds We stock high quality hydroponic and organic cannabis We are experienced professional cannabis growers who place emphasis on the medicinal value rather than the quantity we produce This is why you will frequently see strains listed with a 5050 indicasativa ratio as these strains are best for making the Rick Simpson Oil  ProductPriceQuantity35g Organic White Russian42 EUR  000173  X 7g Organic White Russian70 EUR  000289  X 14g Organic White Russian120 EUR  000495  X 50g Organic White Russian295 EUR  001216  X 35g Organic Chronic42 EUR  000173  X 7g Organic Chronic70 EUR  000289  X 14g Organic Chronic120 EUR  000495  X 50g Organic Chronic295 EUR  001216  X Copyright 20122019 EuCanna,Drugs
DCdutchconnectionUK  The original dutch connection,DCdutchconnectionUK  The original dutch connectionProductsRegistrationLoginDCdutchconnectionUK  Shipping from United KingdomDCdutchconnectionUK is BACK after a long hiatus Lots has changed since we have been gone but our strong stance on providing honest quality products with out adulterants supported by lab results and superb customer feedback has not  We have seen our fair share of success and have an abundance of experience    Therefore we can assure you that your order will be shipped same day when placed before 300pm ready for next day delivery MonFri    Saturday delivery before 10am not guaranteed  DCdutchConnectionUK only sells the best there is Be do NOT sell low purity cut or low grade products    Any off our long term customers will know this We want to let you know that when ordering with DCUK you are getting the very best   Sometimes this means that this is reflected in the price We are not the cheapest but we like to think we have the BEST price to quality ratio  FREE shipping for all orders 150 GBP ProductPriceQuantityFISHSCALE COCAINE 15g80 GBP  000381  X FISHSCALE COCAINE 5g230 GBP  001094  X FISHSCALE COCAINE 10g400 GBP  001903  X PURE PLATINUM MDMA 92 15g80 GBP  000381  X PURE PLATINUM MDMA 92 30g150 GBP  000714  X PURE PLATINUM MDMA 92 50g200 GBP  000952  X AMNESIA HAZE  THC 21  NEW BEST BATCH 15g110 GBP  000523  X AMNESIA HAZE  THC 21  NEW BEST BATCH 30g190 GBP  000904  X AMNESIA HAZE  THC 21  NEW BEST BATCH 55g310 GBP  001475  X ROCK ISOMER S KETAMINE EC 99 7g100 GBP  000476  X ROCK ISOMER S KETAMINE EC 99 15g200 GBP  000952  X ROCK ISOMER S KETAMINE EC 99 30g320 GBP  001523  X LSD BLOTTERS REAL 220ug PSYCHEDELIC FLOWERS 15x75 GBP  000357  X LSD BLOTTERS REAL 220ug PSYCHEDELIC FLOWERS x50190 GBP  000904  X LSD BLOTTERS REAL 220ug PSYCHEDELIC FLOWERS 100x310 GBP  001475  X ROLEXS 150MG MDMA ECSTACY PILLS 100x95 GBP  000452  X ROLEXS 150MG MDMA ECSTACY PILLS x200180 GBP  000857  X ROLEXS 150MG MDMA ECSTACY PILLS 500x350 GBP  001665  X ,Drugs
